company_masked,old_value
1516,"Herbal Remedies, Coworking Spaces, Mobile Gaming, Beauty & Cosmetics, Aerospace, Psychology, Precious Metals, Community Building, Carbon Offsetting, Private Jets, Traditional Chinese Medicine, Consultancy, Legal Tech, Disaster Relief"
1517,"Personal Branding, Audio Equipment, Immigration Services, Student Loans, Remote Work Solutions, Tarot Reading, Banking, Satellite Technology, AI Ethics"
1518,"Freelancing, Content Creation, Restaurants"
1519,"Auditing, Mobile Gaming, Metaverse, Private Jets, Extraterrestrial Life Research, Art Market, Development, Payroll Management, Digital Forensics, Biotechnology Startups, Philanthropy, Skincare"
1520,"Compliance & Regulations, Freelancing, Hospitals, Renewable Energy, Hydroelectric Power, Student Loans, Disaster Relief, Biohacking, Indie Game Development"
1521,Cryptocurrencies
1522,"Loan Management, Home Cleaning Services, Biotechnology, Estate Planning, Corporate Governance, Cultural Heritage, Credit Cards, Microfinance, Remote Work Productivity, Meat Processing, Offshore Oil & Gas, Hi-Fi & Vinyl, Digital Marketing"
1523,"Think Tanks, Medical Devices, Smart Cities, Motorsport, Footwear, Herbal Remedies, High-Stakes Poker, Cryptocurrencies, SETI, Casinos, Self-Publishing, Horse Racing"
1524,"Gig Economy, Streaming Services, Cybersecurity, Sustainability, Digital Identity, Waste Management"
1525,"Wholesale, Manufacturing, Ayurveda, Digital Marketing, Diversity & Inclusion, Mindfulness & Meditation, Intellectual Property, Motorsport, Renewable Construction Materials, Community Building, Influencer Marketing, PPC Advertising"
1526,"SaaS, Intellectual Property, Carbon Offsetting, Neobanks"
1527,"Employee Benefits, Cybersecurity, Digital Identity, Automotive, Furniture Industry, Tennis, Geothermal Energy"
1528,"Agriculture, Estate Planning, Yachting, Recruitment, Freelancing, Hunting & Fishing, NFTs & Digital Art"
1529,Affiliate Marketing
1530,"ESG, Food Processing, Psychology, Home Security, Transhumanism, Hardware Manufacturing, Cryptocurrencies, Tennis"
1531,"Waste Management, Think Tanks, NFTs, Intellectual Property, Private Equity"
1532,"Startups, Streaming Services"
1533,"Indie Game Development, Immigration Services, 3D Printing"
1534,Metaverse
1535,"Digital Nomad Lifestyle, Space Exploration, Music Industry, Yoga & Wellness, Education, Voice Acting, Textiles, Online Betting, Circular Economy, Construction, Finance, Personal Branding"
1536,"Geothermal Energy, Anthropology, IoT, Waste Management, Electric Vehicles"
1537,"Mental Health Awareness, Renewable Construction Materials, Credit Cards, Restaurants"
1538,"Jewelry, K-12 Education, IoT, UFO Studies, Betting Strategies, Skincare, Startups, Gig Economy, Cyberwarfare, Renewable Agriculture, Psychology"
1539,"Football, Real Estate, Fisheries, Skincare, Jewelry, Alcoholic Beverages, Franchising, Cybersecurity, Coffee & Tea Industry, Healthcare, Lobbying, Adventure Sports"
1540,"Remote Work Productivity, Cryptozoology, Think Tanks, Coworking Spaces, Open Source Software"
1541,3D Printing
1542,"Development, Wind Energy, Digital Marketing, NFTs"
1543,"Augmented Reality, Big Data Analytics, Entrepreneurship, Content Creation, Digital Marketing, Digital Identity, Automotive, Smart TVs, Cryptocurrency Mining"
1544,"Hydroelectric Power, Adventure Sports"
1545,"High-Fashion Brands, Accounting Services, Art Market, Smart Grids, Recruitment, Digital Forensics, AI Ethics"
1546,"Legal Tech, Disaster Relief, Remote Work Solutions, Investment, Adventure Tourism, Small Business Management, DIY & Home Improvement, Children’s Digital Rights, E-commerce, Semiconductor Industry, Higher Education, Microfinance"
1547,"Art Market, Food Processing, Paranormal Investigations, Sound Engineering, Research & Development, Meat Processing, Space Tourism, Cryptozoology, Online Betting, Psychology"
1548,"Social Work, Homeopathy, International Law, PPC Advertising"
1549,"Betting Strategies, Bioethics, Waste Management, DIY & Home Improvement, Healthcare, Genetic Engineering, Home Cleaning Services, Wearable Devices"
1550,"Real Estate Investment Trusts, Open Source Software, Personal Branding, Psychology, Podcasting, Government Affairs, Archaeology, Special Education, Tennis, Indie Game Development, Online Betting"
1551,"NGO, Streaming Platforms, Retail, Gaming, Corporate Governance, Metaverse, Philanthropy, Biohacking, Dairy Industry, Geothermal Energy"
1552,"Open Source Software, Crowdsourcing, NFTs & Digital Art, Fraud Detection, Aerospace, Carbon Offsetting, Crisis Management, Wealth Management, Renewable Construction Materials, Cloud Computing, Franchising"
1553,"Sound Engineering, Auditing, Venture Capital, Renewable Energy, SEO, Drones, Remote Work Productivity, Philanthropy, Architecture, Copywriting, Immigration Services, Crowdsourcing, Archaeology, Alternative Medicine, Transhumanism"
1554,"Yoga & Wellness, Retirement Planning, Hospitals, Cultural Heritage, Development, DIY & Home Improvement"
1555,"Retirement Planning, Waste Management, Supply Chain, Sustainable Fashion, Social Media, Charity Organizations, Content Creation, Ayurveda, Hardware Manufacturing"
1556,"Consumer Electronics, Digital Law, Adventure Tourism"
1557,"Meat Processing, Alternative Medicine, Legal Tech"
1558,"Nightlife, Private Equity, Copywriting, Automotive, Big Data Analytics"
1559,"SEO, Education Technology, Digital Nomad Lifestyle"
1560,"Satellite Technology, Yachting, Biometric Authentication, Furniture Industry, Hardware Manufacturing, Movies & Entertainment, NFTs & Digital Art, Basketball, Legal Tech, IT Infrastructure, Cloning & Stem Cell Research, Music Production, Board Games, Think Tanks"
1561,"Pharmaceuticals, Social Work, Cyberwarfare, Drones, Nightlife"
1562,"Gardening & Landscaping, Cloning & Stem Cell Research, Tarot Reading, Indie Game Development, Recycling Industry"
1563,"Lottery, Mobile Gaming, IoT, Cyberwarfare, Renewable Construction Materials, Knowledge Management, Biohacking, Online Betting, Diet & Nutrition, SaaS, Real Estate, Research & Development, Home Security, Biotechnology Startups, Finance"
1564,"Think Tanks, Wholesale, Real Estate, Cyberwarfare, Traditional Chinese Medicine, Genetic Engineering, Subscription Services, Biotechnology"
1565,"Home Automation, Digital Forensics, Power Distribution, Meat Processing, Adventure Tourism, Logistics, Fantasy Sports, Intellectual Property, Luxury Goods, IoT"
1566,"Drones, Basketball, Yoga & Wellness, Pharmaceuticals, Research & Development"
1567,"Precious Metals, Remote Work Solutions, Biotechnology, Research & Development, Diet & Nutrition, Entrepreneurship, High-Fashion Brands, Digital Forensics, Finance, Social Media, Biotechnology Startups, Beauty & Cosmetics, Crisis Management"
1568,"Retirement Planning, Research & Development, Streaming Services, Ethical Hacking, Healthcare, Fraud Detection, Sound Engineering, Homeopathy, Loan Management, Knowledge Management, K-12 Education"
1569,"Hospitality, Interior Design, Firearms & Ammunition, Gardening & Landscaping, Steel, Compliance & Regulations, Fitness Tech"
1570,"Digital Twins, IT Infrastructure, Firearms & Ammunition, Big Data Analytics, Indie Game Development, Higher Education, Business Intelligence, Ride-Sharing, Digital Law, Charity Organizations, Disaster Relief, Homeopathy, DIY & Home Improvement, Cryptozoology"
1571,"Wholesale, Social Media, Higher Education, Microfinance, Diversity & Inclusion, Freelancing, Gambling, Casino Gaming, Book Publishing"
1572,"Influencer Marketing, Startups, Life Coaching, Test Preparation, Cultural Heritage, Motorsport"
1573,"Investment, Fantasy Sports, Cultural Heritage, AI Ethics, Logistics, Research & Development, Healthcare"
1574,"Journalism, Wealth Management, Gaming, Sustainable Fashion, Intellectual Property, Movies & Entertainment, Open Source Software"
1575,"Facial Recognition, Journalism, Indie Filmmaking, Crowdsourcing, Retirement Planning, Public Housing, Children’s Digital Rights, Open Source Software, Medical Devices, Coworking Spaces, Community Building"
1576,"Alcoholic Beverages, Online Betting, Nuclear Energy, Co-Working Spaces, Music Industry, Remote Work Productivity, Defense & Military, IoT, Business Intelligence, Banking, Membership Sites, Home Security, Wearable Devices, Corporate Governance"
1577,"SETI, Semiconductor Industry, Alternative Medicine"
1578,"Cybersecurity, Climate Change, AI Ethics, Lobbying, Home Security, Finance, Sustainability, Digital Marketing, Development, Algorithmic Bias, Retirement Planning, Payroll Management, Crowdsourcing"
1579,"Watches, Wealth Management, Fisheries, Public Housing, AI & Machine Learning"
1580,"Life Coaching, Cryptocurrencies, Perfumes, Digital Banking, Mars Colonization, Data Science, Architecture, Engineering, Renewable Energy, Fundraising, Mental Health Awareness"
1581,"Horse Racing, Student Loans, International Law"
1582,"3D Animation, Business Intelligence, Crowdsourcing"
1583,"Adventure Tourism, PPC Advertising, Voice Acting, Metaverse, Private Equity, Gaming, Spirituality, Herbal Remedies, Carbon Offsetting, Mining Industry, Remote Work Solutions"
1584,"Remote Work Solutions, Lobbying, Digital Twins, Horse Racing, Virtual Reality, Leadership Training, Influencer Marketing"
1585,"Content Creation, Streaming Platforms, Hi-Fi & Vinyl, Alcoholic Beverages, Private Equity, Digital Banking, Anthropology, Climate Change, Subscription Services, E-commerce"
1586,"International Law, Finance, Subscription Services, Smart Cities, Luxury Goods, Financial Inclusion, Intellectual Property, Banking, Gambling, Gig Economy, Stock Markets, Real Estate, Human Resources, Entrepreneurship, AI & Machine Learning"
1587,"Streaming Platforms, Home Cleaning Services, SaaS, Investment, Private Equity, Genetic Engineering, Alcoholic Beverages, Fantasy Sports, Ayurveda, Affiliate Marketing, Personal Branding, Tennis"
1588,NGO
1589,"Legal Tech, Betting Strategies"
1590,"Defense & Military, Longevity Science, Indie Filmmaking, Finance, Mindfulness & Meditation, Diversity & Inclusion, Audio Equipment, Adventure Tourism, Vegan & Organic Foods, Manufacturing, Legal Tech, Anthropology"
1591,"Personal Training, PPC Advertising, Reputation Management, Longevity Science, Business Intelligence, E-commerce, Digital Law, Indie Filmmaking"
1592,"Jewelry, Research & Development, Hunting & Fishing, Human Resources, Accounting Services, Credit Cards, Big Data Analytics, Horse Racing, Streaming Services, UFO Studies, Offshore Oil & Gas, Affiliate Marketing, Insurance"
1593,"International Law, Fisheries, Marine Technology, Agriculture, Public Policy, Public Transport"
1594,"Longevity Science, Book Publishing, Anthropology, Education Technology, Crowdsourcing, Skincare, Retail, Jewelry, Hardware Manufacturing, Pharmaceuticals"
1595,"Streaming Services, Education, Children’s Digital Rights, Book Publishing, Genetic Engineering, Online Course Creation, Workplace Safety, Fantasy Sports, Hardware Manufacturing, Private Equity, Spirituality, SEO, Affiliate Marketing, Gaming"
1596,"Herbal Remedies, Sustainability, Interior Design, Diversity & Inclusion, Dropshipping, Streaming Platforms, Home Automation"
1597,"Education Technology, Furniture Industry, Circular Economy, Retail, Microfinance, Waste Management, Digital Forensics, Food Delivery Services, Entrepreneurship, Voice Acting"
1598,"Food Processing, Dairy Industry, Architecture, Development, Home Security, Luxury Goods, Private Jets, Employee Benefits, Real Estate, Medical Devices, Freelancing, Mindfulness & Meditation, Retail, Aerospace"
1599,"UFO Studies, Small Business Management, Biohacking, Medical Devices, Test Preparation, Social Work, Home Cleaning Services, Microfinance, SEO, Reputation Management, Gaming Consoles, Real Estate Investment Trusts, Digital Law, Music Industry, Higher Education"
1600,"Compliance & Regulations, Music Industry, Renewable Energy, Franchising, Vegan & Organic Foods, Facial Recognition, Leadership Training, Pest Control"
1601,"Insurance, 3D Printing, Venture Capital, Crowdfunding"
1602,"Vegan & Organic Foods, Startups, Influencer Marketing, Paranormal Investigations, Yoga & Wellness"
1603,Private Jets
1604,"Think Tanks, Logistics, Humanitarian Aid, Legal Tech, Education Technology, Adventure Sports, Music Industry, Skincare, Fundraising, Ethical Hacking"
1605,"Renewable Energy, Business Intelligence, Search Engine Optimization, Land Development, Alcoholic Beverages, Public Housing, Digital Banking"
1606,"Motorsport, Logistics, Fundraising, Meat Processing, Smart Cities"
1607,"Online Course Creation, Crowdsourcing, AI & Machine Learning, Lottery, Precious Metals, Music Production, Nightlife, Supply Chain, Mental Health Awareness, Climate Change, Digital Identity, Drones, Membership Sites, Streaming Services, AI Ethics"
1608,"Social Media, Land Development, Online Safety, Fundraising, Skincare"
1609,"Search Engine Optimization, Gambling, Anthropology, Recruitment, Gaming, Beauty & Cosmetics, Solar Energy, Hospitals, Autonomous Vehicles"
1610,"Renewable Construction Materials, Event Management, Cryptocurrencies"
1611,"NFTs, Auditing, Extraterrestrial Life Research, Restaurants, High-Fashion Brands, Defense & Military, Digital Law, Credit Cards, Automotive, Hardware Manufacturing, Reputation Management, Ayurveda, Co-Working Spaces, K-12 Education, Cultural Heritage"
1612,"Journalism, Legal Tech, Adventure Tourism, Cryptozoology, Cyberwarfare, Yoga & Wellness, Beauty & Cosmetics, Firearms & Ammunition, Wealth Management, Waste Management, Cryptocurrencies, Higher Education, Indie Filmmaking, Medical Devices, Neobanks"
1613,"Cyberwarfare, Food Delivery Services, Fitness Tech, Knowledge Management, Sports, Yoga & Wellness, Cryptozoology, Auditing"
1614,"Private Equity, Big Data Analytics, Electric Vehicles, Furniture Industry, Ride-Sharing, Semiconductor Industry"
1615,"Smart Homes, Alcoholic Beverages, Bioethics, Business Intelligence, Marine Technology, Insurance, Horse Racing, AI Ethics"
1616,"Smart Cities, Mobile Gaming, Agriculture, Education, Personal Branding, Hunting & Fishing, Restaurants, Social Media, Waste Management, Firearms & Ammunition, Data Science"
1617,"Astrology, Wholesale, Ethical Hacking, Renewable Energy, Fashion Industry, Tax Consulting, DIY & Home Improvement, Power Distribution, Privacy & Data Protection, Knowledge Management"
1618,"Urban Planning, Stock Markets, Carbon Offsetting, Social Media, Social Work, Wholesale, Hydroelectric Power, Mining Industry, Affiliate Marketing, Smart Cities, Cryptocurrency Mining, Medical Devices"
1619,"Franchising, Alternative Medicine, Retail, Business Intelligence, Music Industry, Beauty & Cosmetics, Casinos, Special Education, Renewable Construction Materials, Tax Consulting, Food Processing"
1620,"Digital Banking, Aerospace, Renewable Energy, Smartwatches, Jewelry, Hydroelectric Power, Education Technology, Streaming Platforms, Consultancy, Fantasy Sports"
1621,"Drones, Pest Control, Archaeology, Open Source Software, NGO, Life Coaching, Streaming Services, Accounting Services, Corporate Social Responsibility"
1622,"Charity Organizations, Architecture, Streaming Platforms, Development"
1623,"Privacy & Data Protection, Remote Work Productivity, Big Data Analytics, Insurance, Digital Twins, Extraterrestrial Life Research, Music Industry, Special Education, Cyberwarfare, Journalism, Banking, Alternative Medicine, Anti-Money Laundering, Public Relations"
1624,"Interior Design, Sustainable Housing, Carbon Offsetting, Renewable Agriculture"
1625,"Carbon Offsetting, Neobanks, 3D Animation, Football, Paranormal Investigations, Power Distribution, Finance, Venture Capital"
1626,"Electric Vehicles, Home Security, Textiles, Cyberwarfare"
1627,Agriculture
1628,"Land Development, Space Tourism, Corporate Social Responsibility, Fisheries, Online Learning, Semiconductor Industry, Gardening & Landscaping, 3D Animation, Education Technology, Wearable Devices, Smart Homes, FMCG, Disaster Relief"
1629,"Herbal Remedies, Hi-Fi & Vinyl, Board Leadership, E-commerce, Beauty & Cosmetics, Casino Gaming, AI Ethics, Online Betting, Space Exploration"
1630,"Alcoholic Beverages, Beauty & Cosmetics, Precious Metals"
1631,"UFO Studies, Human Resources, Automotive, Jewelry, Meat Processing, NFTs & Digital Art, Search Engine Optimization, Development, Ethical Hacking, Fitness Tech, International Law"
1632,"Real Estate, Movies & Entertainment, Smartwatches, Homeopathy, Coffee & Tea Industry, AI & Machine Learning, Art Market, Adventure Tourism, Membership Sites, Traditional Chinese Medicine, Open Source Software"
1633,"Blockchain, Fraud Detection"
1634,"Music Production, AI & Machine Learning"
1635,"Streaming Services, Medical Devices, Intellectual Property, International Law, Vegan & Organic Foods, Extraterrestrial Life Research, Mining Industry, Fantasy Sports, Hospitality, Membership Sites, Precious Metals, Sustainable Fashion, Sustainability, Employee Benefits"
1636,"Cryptocurrency Mining, SaaS, Open Source Software, Online Course Creation, Cultural Heritage, Cloning & Stem Cell Research, Digital Twins"
1637,Geothermal Energy
1638,"Solar Energy, Coffee & Tea Industry, Marine Technology, Smart Grids, Digital Banking, Vegan & Organic Foods, Climate Change, Loan Management, Higher Education, Gardening & Landscaping, Digital Forensics, Tax Consulting, Wealth Management, ESG, PPC Advertising"
1639,"Ride-Sharing, Esports, Community Building, Membership Sites, Public Relations, High-Fashion Brands, Diet & Nutrition, Skincare, Blockchain, Philanthropy, Board Leadership, Home Cleaning Services, Public Transport, Bioethics"
1640,"Nuclear Energy, Digital Twins"
1641,"Online Safety, Data Science, Smart Homes, Restaurants, Financial Inclusion, Workplace Safety, Private Jets, Lottery, Firearms & Ammunition, Membership Sites"
1642,"Digital Identity, Fantasy Sports, Online Betting, Gaming, Consumer Electronics, Smart Cities"
1643,"Online Betting, Biotechnology, Casinos, Electric Vehicles, Knowledge Management, Research & Development, Waste Management, Genetic Engineering, Think Tanks, Voice Acting, Traditional Chinese Medicine, Consultancy"
1644,"Online Betting, Anti-Money Laundering, Disaster Relief, Cybersecurity, Tutoring, Finance"
1645,"Coworking Spaces, NFTs & Digital Art"
1646,"Personal Training, Beauty & Cosmetics, Semiconductor Industry, Paranormal Investigations, Movies & Entertainment, Homeopathy, Test Preparation, Spirituality"
1647,"Recruitment, Ethical Hacking, SaaS, Journalism, Fundraising, Solar Energy, Tutoring, Fashion Industry"
1648,"Private Jets, Hardware Manufacturing, Pest Control, Financial Inclusion, Digital Law, Gambling, Adventure Tourism, Venture Capital, 3D Printing, Lobbying, High-Stakes Poker, Mental Health Awareness, Biohacking, Smart Cities, Insurance"
1649,"Anthropology, Tutoring, Esports, Open Source Software, Finance, Manufacturing, Biotechnology, Big Data Analytics, Investment, Aerospace, Workplace Safety"
1650,"Smart Cities, Biotechnology Startups, Pest Control, Online Course Creation, Lottery, SETI, FinTech, Education, Casino Gaming, Cloud Computing, Insurance, Voice Acting, Supply Chain"
1651,"Manufacturing, Yachting, Crisis Management, Biometric Authentication, Cloud Computing, Mindfulness & Meditation, Agriculture, Archaeology, Circular Economy, Private Equity, Personal Branding"
1652,Algorithmic Bias
1653,"Cryptozoology, Tarot Reading, Yoga & Wellness"
1654,"Biotechnology, Social Media Regulation, Freelancing, Cryptozoology"
1655,"Hunting & Fishing, Betting Strategies, Sustainability, Engineering, Compliance & Regulations, Startups"
1656,"Reputation Management, Jewelry, Paranormal Investigations, Construction, ESG, Meat Processing, Food Processing, Smart Cities"
1657,"Virtual Reality, Philosophy, E-commerce, Firearms & Ammunition, Research & Development, Fitness Tech, Herbal Remedies, Smartwatches, Hospitals, Esports"
1658,"Firearms & Ammunition, Startups, Consumer Electronics, Yoga & Wellness"
1659,"NGO, Diet & Nutrition, Wearable Payments, Mars Colonization, Sustainability, Content Creation, Hospitals, Community Building"
1660,Pest Control
1661,"Wearable Devices, Remote Work Solutions, Logistics, Cryptocurrencies, Small Business Management, Corporate Governance, FinTech, Land Development"
1662,"Surveillance, Anti-Money Laundering, Finance, Logistics, Special Education"
1663,"Co-Working Spaces, Alcoholic Beverages, Investment, International Law, Streaming Platforms, Reputation Management, Genetic Engineering, Renewable Energy, Recruitment, Home Cleaning Services, UFO Studies, Land Development, Virtual Reality, Knowledge Management"
1664,"Voice Acting, Music Industry, Electric Vehicles, Land Development, Facial Recognition, Think Tanks, Retirement Planning, Satellite Technology"
1665,"Smart Homes, Circular Economy, Esports, Firearms & Ammunition, Motorsport, Anti-Money Laundering, Traditional Chinese Medicine, Furniture Industry, Online Betting, Private Jets, Casinos, Big Data Analytics, Neobanks, Luxury Goods, Interior Design"
1666,"Transhumanism, Textiles, Freelancing, Ayurveda, Philanthropy, Hospitals, Cloning & Stem Cell Research, Cloud Computing, NGO, Geothermal Energy, Entrepreneurship, Wind Energy"
1667,"ESG, Hydroelectric Power, Spirituality, Horse Racing"
1668,"Disaster Relief, Higher Education, Co-Working Spaces, Student Loans, Real Estate, Tax Consulting, Sustainable Fashion"
1669,"Smart Grids, Digital Banking, Cybersecurity, Online Learning, Education, Fraud Detection, Search Engine Optimization, Biotechnology"
1670,"Sustainable Housing, SaaS"
1671,"Public Housing, FinTech, Disaster Relief, Community Building, SETI, Hospitality, Metaverse, Open Source Software, Renewable Energy, Solar Energy"
1672,"Big Data Analytics, Food Processing, Football, Precious Metals"
1673,High-Fashion Brands
1674,"Furniture Industry, Mobile Gaming, Tax Consulting, Philanthropy, Co-Working Spaces, Movies & Entertainment, Investment, Cloning & Stem Cell Research, Subscription Services, Ayurveda, Cyberwarfare, Fundraising, UFO Studies"
1675,"Ethical Hacking, NGO, Esports, Neobanks, Defense & Military, Hospitality, Smart Grids, Mars Colonization, Higher Education, Real Estate Investment Trusts, Paranormal Investigations, Education"
1676,"Content Creation, Adventure Sports, 3D Animation"
1677,"Personal Training, Robotics, Carbon Offsetting, Surveillance, Beauty & Cosmetics"
1678,"Nuclear Energy, Music Production, Hi-Fi & Vinyl, Alternative Medicine, Defense & Military, Land Development, Gig Economy, Credit Cards, Crowdsourcing, Logistics, Corporate Governance, Membership Sites"
1679,"Public Relations, Casino Gaming, Psychology, Voice Acting, Fantasy Sports, Meat Processing, Online Course Creation, Intellectual Property, Cloud Computing, High-Fashion Brands, Research & Development"
1680,"Mindfulness & Meditation, Digital Marketing, Test Preparation, Biotechnology, Football, Home Automation, Leadership Training, Adventure Tourism, Social Work, Fisheries"
1681,"Biotechnology Startups, Knowledge Management, Lottery, Public Relations, Ethical Hacking, Hardware Manufacturing"
1682,"Tax Consulting, Digital Storytelling, PPC Advertising, Restaurants, Social Media, Affiliate Marketing, Fraud Detection, Precious Metals, Franchising, Smart TVs, Credit Cards"
1683,"Traditional Chinese Medicine, Consultancy, Mining Industry, Space Tourism, Real Estate, Solar Energy, Investment"
1684,"Herbal Remedies, Transhumanism, Watches, Online Course Creation, Facial Recognition, Geothermal Energy, Public Relations, Mars Colonization, Hospitality, Power Distribution"
1685,"Digital Identity, Private Jets, Pest Control, Solar Energy, Freelancing, Digital Banking, Search Engine Optimization, Research & Development, Philosophy, Cultural Heritage, Cloning & Stem Cell Research"
1686,"Online Course Creation, Beauty & Cosmetics, Archaeology, Gardening & Landscaping, International Law, Vegan & Organic Foods, Defense & Military, Solar Energy, Self-Publishing"
1687,"Humanitarian Aid, Social Media, Digital Law, Tutoring, Cultural Heritage, Immigration Services, Herbal Remedies, Esports, Wind Energy, ESG"
1688,"Dairy Industry, Financial Inclusion, Textiles, Healthcare, K-12 Education, E-commerce, Skincare, Auditing, Membership Sites, Lottery, Interior Design, Digital Marketing, Sustainable Fashion, Reputation Management, Credit Cards"
1689,"Digital Storytelling, Copywriting, Social Media, Robotics, Entrepreneurship, Mining Industry, Wholesale, 3D Animation, Alcoholic Beverages, PPC Advertising, Education, Education Technology, Aerospace, Smart Homes"
1690,"Satellite Technology, AI & Machine Learning, Streaming Platforms, Anthropology, Home Automation"
1691,"Journalism, Life Coaching, Immigration Services, Public Relations"
1692,"Humanitarian Aid, Extraterrestrial Life Research, Alcoholic Beverages, Drones, Biotechnology Startups"
1693,"Hi-Fi & Vinyl, Loan Management, Event Management, Reputation Management, Content Creation, Space Tourism, Football, Paranormal Investigations, 3D Animation"
1694,"Social Work, Electric Vehicles, IoT, Astrology, Audio Equipment"
1695,"Diversity & Inclusion, Reputation Management, Agriculture, Intellectual Property, Cybersecurity, NFTs & Digital Art, Spirituality, Interior Design"
1696,"Mars Colonization, High-Fashion Brands, Consumer Electronics, Cryptocurrencies, Mental Health Awareness, Yachting, Firearms & Ammunition, Ayurveda, Basketball, Public Transport, AI Ethics, Gambling"
1697,"Logistics, Cultural Heritage, Charity Organizations, Engineering, Loan Management, Reputation Management, Social Media Regulation, NFTs, Tax Consulting, Hospitals"
1698,"Sustainable Housing, High-Stakes Poker, Audio Equipment"
1699,"Cryptozoology, Franchising, Spirituality, Algorithmic Bias, Furniture Industry, Digital Storytelling, Business Intelligence, Cultural Heritage, Annuities & Pensions, Steel, SETI"
