company_masked,old_value
1,"Intellectual Property, Climate Change, Sustainable Housing, Home Automation, AI Ethics, Hardware Manufacturing, Yachting, Renewable Agriculture, Online Betting, Horse Racing, PPC Advertising, Social Work, UFO Studies, Human Resources, Automotive"
2,"Human Resources, Copywriting, Annuities & Pensions, Crowdfunding, NFTs, Journalism, Startups"
3,"Life Coaching, Book Publishing, Logistics, Big Data Analytics, 3D Printing, Power Distribution, Compliance & Regulations, SETI, Skincare, Watches"
4,"Food Processing, Remote Work Solutions, Estate Planning, Renewable Agriculture, Fantasy Sports, Astrology, Social Media, Online Betting, Digital Twins, Cybersecurity, Wearable Devices, Online Learning"
5,"Digital Nomad Lifestyle, Mobile Gaming, Smart Cities, Offshore Oil & Gas, Knowledge Management, Wealth Management"
6,"Real Estate, Education, Renewable Energy, Skincare, Semiconductor Industry, Tarot Reading"
7,"Manufacturing, UFO Studies, Transhumanism, Offshore Oil & Gas, Electric Vehicles, Psychology, Marine Technology, Vegan & Organic Foods, Charity Organizations"
8,"Pest Control, Gaming Consoles, Smart Grids"
9,"Tennis, Investment, Legal Tech, Remote Work Productivity, Student Loans, Accounting Services, Firearms & Ammunition, Retirement Planning"
10,"Archaeology, Online Safety, Semiconductor Industry, Herbal Remedies, Diet & Nutrition, Workplace Safety, Pest Control, Dairy Industry, Think Tanks, Search Engine Optimization, Nuclear Energy, Meat Processing, Steel, Cultural Heritage"
11,"Mars Colonization, Astrology, Hospitality, Gig Economy, Personal Branding, Smart Cities, Human Resources, Genetic Engineering"
12,"Virtual Reality, Crisis Management, Smart Cities, Public Housing, Affiliate Marketing, Precious Metals, Transhumanism, Online Learning, Cultural Heritage, E-commerce, Sustainable Housing, Geothermal Energy, Motorsport"
13,"Wholesale, Board Leadership, Content Creation, Augmented Reality, Blockchain, Electric Vehicles, Gaming Consoles, Land Development, Workplace Safety, Private Equity, Humanitarian Aid, Streaming Platforms"
14,"Nuclear Energy, Podcasting, Paranormal Investigations, Cybersecurity, Insurance, IoT, Finance, Disaster Relief"
15,"Satellite Technology, Indie Filmmaking"
16,"Lobbying, Agriculture, Personal Branding, Gardening & Landscaping, Adventure Tourism, Automotive, Digital Nomad Lifestyle"
17,Reputation Management
18,"Fitness Tech, Finance, Adventure Tourism, Neobanks, NFTs & Digital Art, Manufacturing, Motorsport, Ayurveda, Auditing, Nuclear Energy, Nightlife, Diversity & Inclusion, Alternative Medicine"
19,"SaaS, Surveillance, Anti-Money Laundering, Corporate Social Responsibility, Lobbying, Longevity Science, Automotive, Aerospace, Development, Consumer Electronics, Dairy Industry, Social Media, Retirement Planning, Smart Cities"
20,"Small Business Management, Nightlife, Ride-Sharing, Solar Energy, Gig Economy, Hydroelectric Power, Fashion Industry, Education, Biotechnology Startups, Smartwatches, Manufacturing, Business Intelligence, Hospitality, Compliance & Regulations, Gaming Consoles"
21,"Franchising, Recycling Industry, SaaS, Charity Organizations, Corporate Governance, Consumer Electronics, Leadership Training, Luxury Goods, Estate Planning, Biotechnology Startups, Dropshipping, Board Leadership, Remote Work Solutions"
22,"Cyberwarfare, Smart Grids, Interior Design, Venture Capital, Voice Acting, Recycling Industry, Humanitarian Aid, Privacy & Data Protection"
23,"Vegan & Organic Foods, Cryptocurrencies, Construction, UFO Studies, Digital Storytelling, Sports"
24,"Mindfulness & Meditation, Alternative Medicine"
25,"Betting Strategies, Smart Cities, Space Tourism"
26,"Banking, Paranormal Investigations, Genetic Engineering, Tarot Reading, Circular Economy, Education Technology, Satellite Technology, Smart Cities, Freelancing, Smart Grids, Workplace Safety, Insurance, Virtual Reality, Astrology"
27,Venture Capital
28,"UFO Studies, Healthcare, Compliance & Regulations, ESG, Fitness Tech, K-12 Education, Recycling Industry, Betting Strategies, Automotive, Algorithmic Bias, Ride-Sharing, Microfinance, NFTs, Online Safety"
29,"Corporate Social Responsibility, Blockchain, Diet & Nutrition"
30,"Remote Work Solutions, Medical Devices, Fitness Tech, Tarot Reading, Online Learning, Microfinance, Cybersecurity, Social Work, Legal Tech, Board Leadership, AI & Machine Learning, Fashion Industry"
31,"Digital Banking, ESG"
32,"SaaS, Autonomous Vehicles, Online Course Creation"
33,"Smart TVs, Extraterrestrial Life Research, Sports, Special Education, Mental Health Awareness, Finance, Recycling Industry, Herbal Remedies, Wealth Management, Human Resources, High-Stakes Poker, NGO, Personal Training, Crowdsourcing"
34,"Investment, Ayurveda, Banking, NFTs & Digital Art, Community Building, 3D Printing, Digital Banking, Annuities & Pensions, Digital Identity, Crisis Management, Meat Processing, Renewable Construction Materials, Footwear"
35,"SaaS, Construction, Hospitality, Knowledge Management, Public Transport, Finance, Renewable Agriculture, Special Education, Diversity & Inclusion, Traditional Chinese Medicine, Digital Law, Tarot Reading, Open Source Software, Supply Chain"
36,"Event Management, Interior Design, Engineering, Carbon Offsetting, Adventure Tourism, Credit Cards, SEO"
37,"Offshore Oil & Gas, Engineering, Consultancy, Hardware Manufacturing, Sports, Urban Planning, Payroll Management, Marine Technology"
38,"Smart Homes, Nightlife, Robotics, Augmented Reality, Carbon Offsetting, Cyberwarfare, Public Transport, Disaster Relief, Retail, Charity Organizations, Indie Game Development, Watches, Microfinance"
39,"NFTs, Hospitality, SaaS, Hardware Manufacturing, Sustainability"
40,"Hunting & Fishing, Mars Colonization, Football, Cloning & Stem Cell Research, Coworking Spaces, Real Estate Investment Trusts, Social Work, Ride-Sharing, DIY & Home Improvement, Yoga & Wellness, Interior Design, Renewable Construction Materials, Fitness Tech, Finance, Yachting"
41,"Agriculture, Mental Health Awareness, Paranormal Investigations, Logistics, Fitness Tech, Board Games, Digital Forensics, Lobbying, Influencer Marketing, Financial Inclusion, Audio Equipment"
42,Audio Equipment
43,"Legal Tech, Influencer Marketing, Sports, Ethical Hacking, Insurance, Wind Energy, Vegan & Organic Foods, Precious Metals"
44,"Spirituality, Crowdfunding, Renewable Agriculture, Charity Organizations, Higher Education, Biometric Authentication, Crisis Management, Hydroelectric Power, Mental Health Awareness, IT Infrastructure"
45,"Supply Chain, AI Ethics, 3D Printing, Archaeology, Government Affairs"
46,"Waste Management, Logistics, Anti-Money Laundering, Business Intelligence, FinTech, Geothermal Energy, Freelancing, Footwear, High-Fashion Brands"
47,"Wealth Management, Indie Game Development, International Law, Recruitment, Social Media, Surveillance, Online Safety, Anti-Money Laundering, Firearms & Ammunition, High-Stakes Poker, Self-Publishing, Reputation Management"
48,"Motorsport, Biotechnology Startups, Footwear, Precious Metals, Dropshipping, Textiles, Pharmaceuticals, E-commerce, Wearable Payments"
49,"Cryptocurrencies, Book Publishing, Bioethics, Movies & Entertainment, Traditional Chinese Medicine, Horse Racing, Remote Work Solutions, Recruitment, Online Learning, Firearms & Ammunition, 3D Animation, NGO"
50,"Sound Engineering, Virtual Reality, Digital Nomad Lifestyle, Mining Industry, Search Engine Optimization, Indie Game Development, Autonomous Vehicles"
51,"Jewelry, Membership Sites, NFTs"
52,"Footwear, Gig Economy, Music Production, SaaS, Human Resources, Hydroelectric Power, Wearable Devices, Music Industry"
53,"AI Ethics, Student Loans, Surveillance"
54,"Digital Law, Smart Cities, Online Betting, Autonomous Vehicles, Philosophy, UFO Studies, Social Media Regulation, Social Work, Cryptocurrency Mining, Compliance & Regulations, Football, Skincare"
55,"Venture Capital, Gambling, Anthropology, Membership Sites, Corporate Social Responsibility, Mindfulness & Meditation, Watches, AI Ethics"
56,"Credit Cards, Restaurants, Corporate Social Responsibility, Sound Engineering, Private Jets, Casino Gaming, Paranormal Investigations, Book Publishing, Beauty & Cosmetics, Public Transport, Online Safety"
57,"Herbal Remedies, Algorithmic Bias, Blockchain, Investment, PPC Advertising"
58,"Board Games, Blockchain, Investment, Semiconductor Industry, Urban Planning, Space Tourism, Sustainable Fashion, Herbal Remedies, UFO Studies, IT Infrastructure, Art Market, Vegan & Organic Foods, Circular Economy"
59,"Nuclear Energy, Mining Industry, Power Distribution, Data Science, AI Ethics, FinTech, Cloning & Stem Cell Research, Psychology, Semiconductor Industry, Indie Filmmaking"
60,"Traditional Chinese Medicine, Yoga & Wellness, Education Technology, Astrology, Renewable Construction Materials, Sports, Smart TVs"
61,"Waste Management, Crisis Management, Education, Basketball, Payroll Management, Audio Equipment, Podcasting, Algorithmic Bias, Gaming Consoles"
62,"Electric Vehicles, Personal Training, Sustainable Housing, Test Preparation, Student Loans, Casinos, Renewable Energy, NGO, Dropshipping, Drones"
63,"Indie Game Development, Data Science, Wearable Payments, Charity Organizations, Private Equity, Privacy & Data Protection"
64,Hospitality
65,"SEO, Open Source Software, Sound Engineering, Anti-Money Laundering, Meat Processing, Wealth Management, Insurance, Anthropology, Ride-Sharing, Investment, Esports, Offshore Oil & Gas"
66,"Hospitality, Hi-Fi & Vinyl, Digital Marketing"
67,"Streaming Services, Retail, Pharmaceuticals, Augmented Reality, Logistics, Content Creation, Social Work, Land Development, Metaverse, Vegan & Organic Foods, Private Equity, Workplace Safety"
68,"Franchising, Art Market, Fundraising"
69,"Disaster Relief, Freelancing, Dropshipping"
70,"Copywriting, Yoga & Wellness, Steel, Special Education, Startups, Privacy & Data Protection, Consultancy, Casinos, SETI, Space Tourism, Digital Marketing, Indie Filmmaking"
71,"Big Data Analytics, Philanthropy, Traditional Chinese Medicine, Cyberwarfare, Public Housing, IoT, Ride-Sharing, Payroll Management, Digital Marketing, Footwear, Facial Recognition, Education Technology, Smart Cities, Pest Control, FinTech"
72,"Precious Metals, Hydroelectric Power, Pharmaceuticals, Electric Vehicles, Open Source Software, Renewable Agriculture, Content Creation"
73,"Streaming Services, 3D Printing, NGO, Smart Cities, Compliance & Regulations, Crisis Management, Waste Management, Restaurants, Tarot Reading, Test Preparation"
74,"AI Ethics, Vegan & Organic Foods, IT Infrastructure, Herbal Remedies, Smart Cities, NGO, Ride-Sharing, Investment, Mobile Gaming, Data Science, Human Resources, Solar Energy, Reputation Management, Entrepreneurship"
75,"Architecture, Automotive, Voice Acting, Construction"
76,"Biotechnology, Adventure Sports, Renewable Agriculture, Longevity Science, Ride-Sharing, Education Technology, Voice Acting, Neobanks, Solar Energy, Steel, Restaurants, Private Equity, Circular Economy, Watches, Defense & Military"
77,"Gardening & Landscaping, Loan Management, Stock Markets, Indie Game Development, Online Learning, Sound Engineering"
78,Immigration Services
79,"Art Market, Mobile Gaming, Content Creation, Special Education, Manufacturing, Online Learning, Digital Law, Cryptozoology, Aerospace, Fundraising, Annuities & Pensions, Architecture"
80,"Interior Design, Venture Capital"
81,"UFO Studies, Adventure Sports, Real Estate, Fundraising, Surveillance, Art Market, Cryptocurrency Mining, Smart Cities, IT Infrastructure, Auditing, Consultancy, Cryptocurrencies, Gambling, Wind Energy, Crowdfunding"
82,"Hunting & Fishing, Auditing, Lobbying, Transhumanism, Compliance & Regulations, Sustainable Housing, Government Affairs, Fitness Tech, Gig Economy, Sports, Recruitment, Biotechnology, Digital Banking, IT Infrastructure"
83,"Streaming Services, Hydroelectric Power, Geothermal Energy"
84,"Private Equity, Carbon Offsetting, Online Learning"
85,"Franchising, Consultancy, Ayurveda, Paranormal Investigations, Restaurants, FMCG, Compliance & Regulations"
86,"Tennis, Cultural Heritage, Blockchain, Algorithmic Bias, Digital Twins, Research & Development, Small Business Management, Cloud Computing, Fitness Tech, Semiconductor Industry, K-12 Education"
87,"Horse Racing, Casino Gaming, Startups, Drones, UFO Studies, Healthcare, Wind Energy, Skincare, Cyberwarfare, Loan Management, Logistics, Fraud Detection, Astrology, Philosophy"
88,"Annuities & Pensions, Private Jets, Social Work, Sustainable Fashion, Loan Management, Hospitals, Sports, Sound Engineering, Dairy Industry"
89,"Architecture, Hospitality, Gardening & Landscaping, Data Science"
90,"Lobbying, Voice Acting, Firearms & Ammunition, Manufacturing, Pharmaceuticals, International Law, Cybersecurity"
91,"Knowledge Management, Philanthropy, Cryptozoology, Accounting Services, Gig Economy, Remote Work Productivity, Supply Chain, Music Production, Marine Technology"
92,"DIY & Home Improvement, Wearable Devices, High-Stakes Poker, Digital Twins, Mining Industry, AI Ethics, Watches, Coworking Spaces, Music Production, Pest Control, Automotive, Music Industry, Logistics"
93,"Interior Design, PPC Advertising, Smart Cities, Movies & Entertainment, K-12 Education, Carbon Offsetting, Virtual Reality, Human Resources, Life Coaching, Offshore Oil & Gas, Power Distribution, Extraterrestrial Life Research, Watches, Cloud Computing, Microfinance"
94,"Engineering, Virtual Reality, Entrepreneurship, Sustainability, Personal Branding, Digital Law, Disaster Relief, Casino Gaming, Higher Education"
95,"Self-Publishing, Waste Management, Hardware Manufacturing, Herbal Remedies, Steel, Co-Working Spaces, Education, Architecture, Gig Economy, Estate Planning, Art Market, AI & Machine Learning, Home Security, Online Course Creation"
96,"Digital Banking, AI Ethics, Movies & Entertainment, Self-Publishing, Hospitals, Dropshipping, Small Business Management, Disaster Relief, Transhumanism, Annuities & Pensions"
97,"Music Industry, AI & Machine Learning, Gaming, Defense & Military, Motorsport"
98,"Social Work, Paranormal Investigations, PPC Advertising, Search Engine Optimization, Football, Skincare, Mining Industry"
99,"DIY & Home Improvement, Biometric Authentication, Real Estate Investment Trusts, Co-Working Spaces, Jewelry, Interior Design"
100,"Credit Cards, Digital Storytelling"
101,"Psychology, PPC Advertising, Anthropology"
102,"Motorsport, Interior Design, Smart Grids"
103,"Digital Marketing, Cryptocurrency Mining, Betting Strategies, Sound Engineering, Board Leadership, Private Jets, Architecture, Humanitarian Aid, Adventure Tourism, Waste Management, Personal Branding, Banking, Tarot Reading, E-commerce"
104,"Personal Training, Cryptocurrency Mining, Pharmaceuticals, NFTs & Digital Art, E-commerce, Remote Work Productivity, Intellectual Property, Voice Acting, Venture Capital, Lottery, Luxury Goods, SEO, Blockchain, Food Processing, Meat Processing"
105,"Personal Branding, Social Media Regulation"
106,"Sports, Search Engine Optimization, Hunting & Fishing, Longevity Science"
107,"Cryptocurrency Mining, Yoga & Wellness, Higher Education, Influencer Marketing"
108,"Human Resources, Hunting & Fishing, Sound Engineering, Coffee & Tea Industry, Financial Inclusion, Biometric Authentication, Data Science, Social Media, Manufacturing, Coworking Spaces, Philosophy"
109,"Charity Organizations, NFTs & Digital Art, Startups, Fundraising"
110,"Payroll Management, Insurance, Diversity & Inclusion, Alternative Medicine, Smart TVs, Data Science, Recruitment, Digital Marketing, Think Tanks, Jewelry"
111,"Cryptocurrencies, Ethical Hacking, Cloning & Stem Cell Research, Retail, Gig Economy, Wind Energy, Biotechnology"
112,"Dairy Industry, Surveillance, Online Betting, Astrology"
113,"Electric Vehicles, Solar Energy, Online Learning, AI & Machine Learning, Streaming Platforms, Remote Work Solutions, Insurance, Gardening & Landscaping, Philanthropy, Offshore Oil & Gas"
114,"Space Tourism, Coffee & Tea Industry"
115,"Test Preparation, Biotechnology Startups, Microfinance, Waste Management, Food Delivery Services, Coworking Spaces, Mining Industry, K-12 Education, Knowledge Management, Digital Forensics, Intellectual Property"
116,"SETI, Private Equity, Algorithmic Bias"
117,"Tax Consulting, Cloud Computing, Crowdsourcing"
118,"Jewelry, Small Business Management, PPC Advertising"
119,"Data Science, Smart Homes"
120,"Music Production, Hydroelectric Power, Wind Energy, Recruitment, Genetic Engineering, Robotics, Neobanks, 3D Animation, UFO Studies, Leadership Training, Government Affairs"
121,Gig Economy
122,"Home Automation, NFTs & Digital Art, NFTs, Membership Sites, Venture Capital, Crisis Management, Climate Change, Tennis, Meat Processing, Stock Markets, Remote Work Productivity"
123,"Astrology, Football, Community Building"
124,"Open Source Software, Fraud Detection, Copywriting, Entrepreneurship, AI Ethics"
125,"Firearms & Ammunition, DIY & Home Improvement, Skincare, Public Transport, Healthcare, Wearable Devices, Beauty & Cosmetics, Fantasy Sports, K-12 Education, Lottery, Digital Law, Perfumes, Spirituality, Influencer Marketing"
126,Stock Markets
127,"AI Ethics, 3D Printing, Casinos, Virtual Reality, Affiliate Marketing, Wind Energy, Venture Capital, Footwear"
128,"PPC Advertising, Online Betting, Digital Forensics, Education"
129,"Compliance & Regulations, Digital Storytelling, NFTs, Tax Consulting, Construction, Small Business Management, Streaming Platforms, Alcoholic Beverages, Skincare, Biometric Authentication"
130,"Space Tourism, Humanitarian Aid, Luxury Goods, Architecture, Banking, Influencer Marketing, Metaverse, ESG, Education Technology"
131,"Cultural Heritage, Startups, Home Cleaning Services, Business Intelligence, Accounting Services, Humanitarian Aid, Crowdsourcing, Philanthropy, Space Tourism, Footwear"
132,"Hospitals, Logistics, Metaverse, Fitness Tech, Traditional Chinese Medicine, Fantasy Sports, Healthcare, Power Distribution, Digital Forensics"
133,"Wealth Management, Perfumes, Dairy Industry, Smart Cities, Defense & Military, Social Media Regulation"
134,"Subscription Services, Fitness Tech, Data Science, Big Data Analytics, Sustainable Housing, Fraud Detection, Credit Cards, Herbal Remedies, Indie Game Development, Music Industry, Aerospace, Football, Business Intelligence, Biotechnology Startups"
135,"Student Loans, Private Equity, Annuities & Pensions, Higher Education, E-commerce, Adventure Sports"
136,"Audio Equipment, Human Resources, Loan Management, Tax Consulting, Biotechnology Startups, Search Engine Optimization, Football, Content Creation"
137,"Payroll Management, Textiles, Financial Inclusion, Diet & Nutrition, IT Infrastructure, Digital Twins, Climate Change, Online Safety, Engineering"
138,"Education Technology, Recruitment, Football, Motorsport, Home Cleaning Services, Circular Economy, Search Engine Optimization, NFTs & Digital Art, Anthropology"
139,"Employee Benefits, Charity Organizations, Carbon Offsetting, Interior Design, Healthcare, Humanitarian Aid, Paranormal Investigations, International Law, Adventure Sports, Smart Homes, Immigration Services, Public Relations, Music Industry, Tennis, Hospitals"
140,Wind Energy
141,"Art Market, Crowdsourcing, Public Relations, Open Source Software, Autonomous Vehicles, Personal Training, Cyberwarfare, Search Engine Optimization, Payroll Management, Research & Development, NFTs, Gig Economy, Test Preparation, Reputation Management, Tennis"
142,"Data Science, Fitness Tech"
143,"Autonomous Vehicles, Government Affairs"
144,"Mobile Gaming, Hospitals, Think Tanks, Leadership Training, Space Exploration, Surveillance, Jewelry, Fantasy Sports, Construction, Stock Markets"
145,"Homeopathy, Content Creation, Stock Markets, Insurance, Corporate Social Responsibility, Hospitals, Streaming Platforms, Gaming Consoles, DIY & Home Improvement, K-12 Education, IoT, FinTech, 3D Printing, Charity Organizations, Music Production"
146,"Casino Gaming, Online Course Creation, Alternative Medicine, Stock Markets, Drones, Sustainable Housing, Search Engine Optimization, Urban Planning, Football, Biohacking"
147,"Neobanks, Children’s Digital Rights, Medical Devices, Algorithmic Bias, Stock Markets, Reputation Management, Music Industry, Coffee & Tea Industry, Personal Training, Tarot Reading, Consumer Electronics, AI & Machine Learning"
148,"Streaming Services, Facial Recognition, Board Leadership"
149,"Smart Grids, Philosophy, Private Equity, Consultancy, Online Learning, Restaurants, Entrepreneurship, Mental Health Awareness, Think Tanks, Betting Strategies, Automotive, Sustainable Fashion"
150,"Finance, Private Jets, Robotics, Digital Identity, Auditing, High-Stakes Poker"
151,"Food Delivery Services, Insurance, Fantasy Sports"
152,"Charity Organizations, Automotive, ESG, AI Ethics, Cryptozoology"
153,"Movies & Entertainment, High-Stakes Poker, Semiconductor Industry, Construction, Crisis Management, Basketball, Beauty & Cosmetics, IoT, Biohacking, Hospitality, Electric Vehicles"
154,"Geothermal Energy, AI & Machine Learning, Blockchain, Fraud Detection, Healthcare, Copywriting, Luxury Goods"
155,Investment
156,"Perfumes, Microfinance, Annuities & Pensions, Think Tanks, Influencer Marketing, Cryptocurrency Mining"
157,"Space Exploration, Sports, Freelancing, Search Engine Optimization, Book Publishing, Intellectual Property, Furniture Industry, Cybersecurity, Event Management, Agriculture, Renewable Agriculture, Loan Management"
158,"Alternative Medicine, Footwear, Perfumes, Blockchain, Digital Nomad Lifestyle"
159,"Biotechnology Startups, DIY & Home Improvement, Jewelry, FinTech, Test Preparation, Development, PPC Advertising, Renewable Energy, Fundraising, Consumer Electronics, Streaming Platforms, Facial Recognition"
160,"3D Printing, Streaming Platforms, Hi-Fi & Vinyl, Annuities & Pensions, Real Estate, Smart Homes, Crisis Management, Cybersecurity, Student Loans"
161,"Semiconductor Industry, Land Development, Subscription Services, Business Intelligence, Extraterrestrial Life Research, Credit Cards, Cybersecurity, Membership Sites, Mining Industry, Student Loans"
162,"Annuities & Pensions, Pest Control, Food Delivery Services, Digital Banking, Corporate Governance, Logistics, Payroll Management, Music Industry, Casino Gaming, Paranormal Investigations, Archaeology, Tarot Reading, Neobanks, Traditional Chinese Medicine"
163,"Fraud Detection, Autonomous Vehicles, Think Tanks, Sound Engineering, Children’s Digital Rights, Startups, Construction"
164,"Steel, NFTs, Tennis, PPC Advertising, Board Games, Stock Markets, Big Data Analytics, Sound Engineering, Anti-Money Laundering"
165,"NFTs & Digital Art, Sports, Traditional Chinese Medicine, Recruitment, Biohacking"
166,"AI & Machine Learning, Food Delivery Services, Remote Work Productivity, Self-Publishing, Hospitality, Life Coaching"
167,"Copywriting, Freelancing"
168,"Medical Devices, Financial Inclusion, Mental Health Awareness, Yachting, Adventure Sports"
169,Meat Processing
170,"Restaurants, High-Stakes Poker, Food Processing, Watches, Art Market, Public Policy, Gardening & Landscaping, Leadership Training, IoT"
171,"Franchising, Stock Markets"
172,"Home Security, Food Delivery Services"
173,"Electric Vehicles, Luxury Goods"
174,"Crowdsourcing, Autonomous Vehicles, Community Building, Personal Training, Wealth Management, Homeopathy, Employee Benefits"
175,"Student Loans, Cyberwarfare, Startups, Agriculture, Smartwatches, Gardening & Landscaping, SETI, Precious Metals, Alcoholic Beverages, Healthcare, Entrepreneurship, Vegan & Organic Foods, ESG, Neobanks, Estate Planning"
176,"Private Jets, Smartwatches, Digital Storytelling, Cloning & Stem Cell Research, Copywriting, IoT, Facial Recognition, Estate Planning, Leadership Training, Tarot Reading, Personal Branding, Power Distribution, Public Policy, Board Leadership, Meat Processing"
177,"Mobile Gaming, Co-Working Spaces, Remote Work Productivity, Watches, Online Course Creation, Vegan & Organic Foods, Recycling Industry, SEO"
178,"Circular Economy, Electric Vehicles, Life Coaching, Dairy Industry, Adventure Sports, Betting Strategies, Reputation Management, Influencer Marketing, Education, Finance, Loan Management, SETI, Architecture, Fitness Tech, Healthcare"
179,"Robotics, Satellite Technology, Digital Storytelling, Coworking Spaces, Music Industry"
180,"Art Market, Cryptozoology, Circular Economy, Public Housing"
181,"Big Data Analytics, Blockchain, Home Automation"
182,"Voice Acting, High-Stakes Poker, Sustainability, Steel, Corporate Governance, Urban Planning, Real Estate Investment Trusts, Art Market, Cyberwarfare, Social Media Regulation, Facial Recognition, Humanitarian Aid, Agriculture, Sound Engineering, Reputation Management"
183,"Investment, Digital Banking"
184,"Business Intelligence, Diversity & Inclusion, Digital Forensics, Wearable Devices, Sound Engineering, Digital Identity, Wind Energy, Meat Processing"
185,"Renewable Energy, Manufacturing, International Law, High-Fashion Brands, Home Automation, Ayurveda, Recruitment"
186,"Community Building, Subscription Services, NFTs, Ayurveda, Knowledge Management"
187,"Yachting, Herbal Remedies, Disaster Relief, Textiles, Investment, Hunting & Fishing, Motorsport, Pest Control, Sound Engineering, Mining Industry, Biometric Authentication, Mobile Gaming"
188,"Digital Banking, Spirituality, Banking, Hunting & Fishing, Online Course Creation, Coffee & Tea Industry, Open Source Software, Influencer Marketing, Microfinance"
189,Crowdsourcing
190,"AI & Machine Learning, Cloud Computing, Fisheries, Beauty & Cosmetics, Space Exploration, K-12 Education, Real Estate Investment Trusts, Virtual Reality, Smart Cities, Pharmaceuticals, Steel"
191,"Automotive, Biohacking"
