company_masked,old_value
4472,"Neobanks, Influencer Marketing, Wind Energy, Adventure Tourism, Crowdfunding, IT Infrastructure"
4473,"Luxury Goods, Architecture, Research & Development, Dairy Industry, Sports, SaaS, Personal Branding, High-Stakes Poker, Gig Economy, Remote Work Solutions, Longevity Science, Wind Energy, Hunting & Fishing, Genetic Engineering, Compliance & Regulations"
4474,"Biotechnology, Remote Work Solutions, Adventure Sports, Climate Change"
4475,Traditional Chinese Medicine
4476,"K-12 Education, Supply Chain, Higher Education, Podcasting, Hi-Fi & Vinyl, Textiles, Wearable Devices, Intellectual Property, Digital Forensics, Payroll Management"
4477,"High-Stakes Poker, Beauty & Cosmetics, Yachting"
4478,"Hospitals, Gig Economy, Tax Consulting, Smart TVs, Event Management, Solar Energy"
4479,"Motorsport, Board Games, Accounting Services, DIY & Home Improvement, Hunting & Fishing, Architecture, Footwear, Robotics, Fitness Tech"
4480,"E-commerce, Government Affairs, Real Estate, Financial Inclusion, Freelancing, Charity Organizations, Legal Tech, Geothermal Energy, Engineering"
4481,Psychology
4482,"SETI, Digital Forensics, Online Betting, Payroll Management, Gaming"
4483,"Movies & Entertainment, Education Technology, Extraterrestrial Life Research, Personal Branding, Coworking Spaces, Firearms & Ammunition, Facial Recognition, Tarot Reading"
4484,"Smartwatches, Education, Renewable Agriculture, Home Cleaning Services, Event Management"
4485,"Insurance, Subscription Services, Satellite Technology, Special Education, Healthcare, Electric Vehicles, Marine Technology, Digital Nomad Lifestyle, Crowdfunding, Sound Engineering, Robotics, Private Equity, Digital Banking, Gaming, Consultancy"
4486,"Agriculture, Space Tourism, Meat Processing, Sports, Coworking Spaces, Content Creation, Skincare, Children’s Digital Rights, 3D Printing"
4487,"PPC Advertising, Food Delivery Services, Public Housing, Watches, Tarot Reading, Aerospace, Digital Law, Digital Forensics, Test Preparation, Firearms & Ammunition"
4488,"Audio Equipment, Education"
4489,"Offshore Oil & Gas, Self-Publishing, Mental Health Awareness, Aerospace, Recruitment, Basketball, Biotechnology"
4490,"Education, Sustainable Fashion, Pharmaceuticals, Football, Lobbying, Online Betting, Charity Organizations, Disaster Relief, Spirituality, Mining Industry, Tax Consulting, Philosophy, Solar Energy"
4491,"Renewable Construction Materials, Transhumanism, Public Policy, Social Media, Climate Change, Smart Grids, Solar Energy, Nightlife, Biotechnology, Biohacking, Psychology, Mindfulness & Meditation, Community Building"
4492,"Banking, Mining Industry, Startups, Anti-Money Laundering, Credit Cards, High-Fashion Brands"
4493,"Smart Cities, Recycling Industry, Hydroelectric Power, Remote Work Solutions, Voice Acting, Test Preparation, Workplace Safety, Consumer Electronics, Self-Publishing, Geothermal Energy, Spirituality, Lottery, Digital Banking"
4494,"Human Resources, Wearable Devices, Land Development, SEO, Indie Game Development, High-Fashion Brands, Biotechnology, Insurance"
4495,"Digital Marketing, Meat Processing, Subscription Services, Online Safety, Beauty & Cosmetics, Mobile Gaming, Ride-Sharing, Hydroelectric Power, Renewable Agriculture, Freelancing, Online Course Creation, Insurance, Influencer Marketing, Hospitals, Renewable Construction Materials"
4496,"Cloud Computing, Motorsport, Anti-Money Laundering, Digital Banking, Disaster Relief, NGO, Cybersecurity, Marine Technology, Streaming Services"
4497,"Hospitality, Bioethics, Casino Gaming"
4498,"Fisheries, Disaster Relief, Wholesale, Big Data Analytics, Traditional Chinese Medicine, Crowdsourcing, Book Publishing, Casino Gaming, Architecture"
4499,"Space Exploration, Genetic Engineering, IoT, Digital Storytelling, High-Stakes Poker, Digital Nomad Lifestyle, Sports, Disaster Relief, Mining Industry, Agriculture, Hospitality, IT Infrastructure, Philanthropy, Recruitment"
4500,"FMCG, Freelancing, Disaster Relief"
4501,"Beauty & Cosmetics, NFTs & Digital Art, Watches, Investment, Sports, Yoga & Wellness, Food Delivery Services, Crowdsourcing, Think Tanks, Startups, Recruitment, Fantasy Sports, Metaverse, Space Tourism"
4502,"Yoga & Wellness, Philosophy, Privacy & Data Protection, Footwear, Board Leadership, Wearable Payments, Book Publishing, Lobbying, Football, Sustainable Housing"
4503,"Tax Consulting, Autonomous Vehicles"
4504,"Social Work, Tarot Reading, Coworking Spaces, Autonomous Vehicles, Think Tanks, Wholesale, Homeopathy, Knowledge Management"
4505,"Autonomous Vehicles, Online Betting, Venture Capital, Anti-Money Laundering, Real Estate Investment Trusts, Manufacturing, Solar Energy, FMCG, Hi-Fi & Vinyl, Psychology, Precious Metals, Corporate Social Responsibility, Beauty & Cosmetics, Human Resources, Alternative Medicine"
4506,"Food Delivery Services, Consumer Electronics, Development, Membership Sites, Content Creation, Transhumanism, Solar Energy, Cryptocurrency Mining, Traditional Chinese Medicine, Personal Branding, Podcasting, Remote Work Solutions, Skincare"
4507,"Wealth Management, Board Games"
4508,"Cryptozoology, SaaS, 3D Printing, Longevity Science"
4509,Satellite Technology
4510,"Tennis, Public Transport, Public Relations, Small Business Management, Motorsport"
4511,"Privacy & Data Protection, Tax Consulting, Community Building"
4512,"Pharmaceuticals, Mars Colonization, Beauty & Cosmetics, Blockchain, Test Preparation, Reputation Management, IT Infrastructure, Biotechnology"
4513,"Venture Capital, Lobbying, Audio Equipment, Supply Chain, Lottery"
4514,"Online Betting, Venture Capital, Renewable Agriculture"
4515,"Basketball, Wind Energy, Employee Benefits"
4516,Gaming Consoles
4517,"IT Infrastructure, Streaming Services, Yoga & Wellness, Smart Homes, Precious Metals, Music Production, Surveillance, Neobanks, Real Estate Investment Trusts, Indie Filmmaking"
4518,"Annuities & Pensions, Marine Technology, Restaurants, Crowdfunding, Geothermal Energy, Gaming Consoles"
4519,"Crowdsourcing, Urban Planning, Gardening & Landscaping, IoT, Renewable Construction Materials, Aerospace, Stock Markets, International Law, Surveillance, Movies & Entertainment, 3D Animation, Crowdfunding"
4520,"Agriculture, Restaurants, Tennis, Sports, Renewable Construction Materials, Co-Working Spaces, Space Exploration, Betting Strategies, Nightlife, Event Management, Renewable Agriculture, Philanthropy, Online Learning"
4521,"Power Distribution, ESG, Basketball, Carbon Offsetting, Business Intelligence, Employee Benefits"
4522,"Digital Law, High-Stakes Poker, Extraterrestrial Life Research"
4523,"Startups, SETI, Investment, Meat Processing, Alcoholic Beverages, Education, Esports, Estate Planning, Wearable Devices, Smart Cities, Manufacturing, Freelancing, Social Media, Private Jets"
4524,"PPC Advertising, Food Delivery Services, Watches, Metaverse, Beauty & Cosmetics, Furniture Industry, IT Infrastructure, Tarot Reading, Streaming Services, Transhumanism, AI Ethics"
4525,"Fundraising, AI Ethics, Big Data Analytics, Digital Banking, Crowdsourcing, Esports"
4526,"Adventure Tourism, Dairy Industry, Children’s Digital Rights, Circular Economy, Personal Branding, Jewelry, Data Science, Furniture Industry, Streaming Platforms, High-Stakes Poker, Higher Education"
4527,"Electric Vehicles, Augmented Reality, Interior Design, Cyberwarfare, Privacy & Data Protection, Space Tourism, Financial Inclusion, 3D Animation, FinTech, Remote Work Productivity, Surveillance, Renewable Energy, Yoga & Wellness, Public Housing, Aerospace"
4528,"Gaming, Open Source Software, Watches, Smart Grids, Fashion Industry"
4529,"Accounting Services, Esports, Pest Control, Archaeology, ESG, Recruitment, Copywriting, Cloning & Stem Cell Research, Autonomous Vehicles, Yachting, Digital Forensics, Stock Markets, Content Creation, AI Ethics"
4530,"Land Development, Knowledge Management, Franchising, Corporate Governance, Consultancy, Dropshipping, UFO Studies, Education Technology, Home Automation, Gaming Consoles, Streaming Services, Consumer Electronics, Investment, E-commerce, Lobbying"
4531,"Smart Grids, High-Fashion Brands, SaaS, Smartwatches, Test Preparation, Knowledge Management, Herbal Remedies, Workplace Safety, Indie Game Development, Crowdsourcing"
4532,"Gaming, Geothermal Energy, Hospitality"
4533,"Philanthropy, Mental Health Awareness, Entrepreneurship, Public Housing, Leadership Training, Gambling, Yachting, Smart Grids, Hunting & Fishing, Estate Planning, Big Data Analytics, Compliance & Regulations"
4534,"Footwear, Food Processing, Metaverse, Investment, Esports, FMCG, Biotechnology Startups, Real Estate Investment Trusts"
4535,"Streaming Platforms, Satellite Technology, Geothermal Energy, Gardening & Landscaping, Digital Nomad Lifestyle, Cloud Computing, Influencer Marketing, Private Equity, Journalism, Life Coaching"
4536,"Influencer Marketing, Digital Identity, SaaS, Streaming Platforms, High-Stakes Poker, Higher Education, Gaming Consoles, Biohacking"
4537,"Retail, Mars Colonization, Extraterrestrial Life Research, Home Security, Football, Perfumes, Sports, Biometric Authentication, Stock Markets"
4538,"Charity Organizations, Meat Processing, Search Engine Optimization, Privacy & Data Protection, Climate Change, Home Automation, Firearms & Ammunition, Knowledge Management"
4539,"Digital Forensics, Recycling Industry, Insurance, Wholesale, Nuclear Energy, SaaS, Interior Design, High-Stakes Poker, Voice Acting, Social Media, Healthcare"
4540,"Smart Cities, Real Estate, Mindfulness & Meditation, Geothermal Energy, Semiconductor Industry, Jewelry"
4541,"Children’s Digital Rights, Textiles, Mining Industry, Wind Energy, Personal Training, Tutoring, Spirituality, FinTech, Supply Chain, Reputation Management, Circular Economy"
4542,"Electric Vehicles, Solar Energy, Vegan & Organic Foods, Healthcare, Casino Gaming, Digital Nomad Lifestyle, Genetic Engineering, Astrology, Credit Cards"
4543,"Diet & Nutrition, Indie Game Development, Corporate Social Responsibility, Nightlife, Real Estate Investment Trusts, Microfinance, Textiles, Fitness Tech, Community Building, Board Games, Entrepreneurship, Skincare, Automotive"
4544,"Sustainable Fashion, Smartwatches, Tennis, Social Media Regulation, Affiliate Marketing, Compliance & Regulations, Stock Markets, Public Policy, Digital Storytelling, Psychology, Diet & Nutrition, Ethical Hacking, Finance"
4545,"NFTs, Hardware Manufacturing, Coworking Spaces, Cloning & Stem Cell Research, Steel, Auditing, Digital Twins, Retirement Planning, Art Market, Insurance, Fashion Industry, Solar Energy, Watches, Alternative Medicine, Annuities & Pensions"
4546,"Board Leadership, Digital Law, Self-Publishing, Cloud Computing, SEO, Lottery, Philosophy"
4547,"Cryptocurrency Mining, Jewelry, Personal Training"
4548,"Cloning & Stem Cell Research, Smart Homes, Archaeology"
4549,"Anti-Money Laundering, Gaming Consoles"
4550,"Alternative Medicine, Smartwatches, Jewelry"
4551,"Food Processing, Online Betting, Reputation Management, Biotechnology Startups, Casinos, Virtual Reality, Digital Identity, Interior Design, Betting Strategies, Humanitarian Aid, Membership Sites, Hospitals"
4552,"Medical Devices, Finance, Textiles, Real Estate, Wealth Management, Music Industry, Art Market, Accounting Services, UFO Studies, IoT, SaaS, Archaeology, Tennis"
4553,"Stock Markets, Herbal Remedies, DIY & Home Improvement, Psychology, FinTech, Fundraising"
4554,"Alcoholic Beverages, Workplace Safety, Marine Technology, Digital Identity, Sustainable Housing, Homeopathy, Circular Economy, Fitness Tech, Gardening & Landscaping, Legal Tech, Fantasy Sports, IT Infrastructure"
4555,Lobbying
4556,"Social Work, Ethical Hacking, Mindfulness & Meditation, Startups, Fantasy Sports, Herbal Remedies, Board Leadership, Power Distribution, Public Transport, Surveillance"
4557,"Personal Training, Cloning & Stem Cell Research, Hydroelectric Power, Student Loans, Psychology"
4558,"Mental Health Awareness, Recruitment, Biohacking, Betting Strategies, SEO, SETI, Restaurants, Audio Equipment, Disaster Relief, Neobanks, Music Industry, Renewable Energy, Paranormal Investigations, Workplace Safety"
4559,"Hunting & Fishing, Knowledge Management, Precious Metals, Semiconductor Industry, Immigration Services, Wearable Payments, Insurance, Human Resources, Retail, Retirement Planning, Sustainability, Book Publishing, Education, Stock Markets, Firearms & Ammunition"
4560,"Robotics, Education, Precious Metals, Tennis, Paranormal Investigations, Indie Game Development, Geothermal Energy, E-commerce, Community Building, Coworking Spaces, Meat Processing, Home Cleaning Services"
4561,"Drones, Beauty & Cosmetics, Hospitality, Cultural Heritage, Personal Training, Smart Grids, Smartwatches, Public Transport, Accounting Services, Ride-Sharing, Textiles, AI Ethics"
4562,"Smartwatches, Mining Industry, Archaeology, Indie Filmmaking, Gaming Consoles, Music Industry, Banking, Alcoholic Beverages, Skincare, Wearable Devices, Betting Strategies"
4563,"Marine Technology, Tutoring"
4564,"Membership Sites, Pest Control, Stock Markets, Psychology, Financial Inclusion, Gig Economy, Smart Cities, Spirituality"
4565,"K-12 Education, Streaming Platforms, Digital Twins, Perfumes, Smart TVs, Wind Energy, Gig Economy"
4566,"Payroll Management, Wearable Payments, Higher Education, Home Automation"
4567,"Renewable Construction Materials, Auditing, Venture Capital, Personal Branding, Education Technology, Search Engine Optimization, Loan Management, Philosophy"
4568,"Freelancing, Loan Management, Genetic Engineering, Digital Nomad Lifestyle, Smart Cities, Music Industry, Remote Work Solutions, Research & Development, Footwear, Home Automation, Metaverse, Ethical Hacking, Charity Organizations"
4569,"Mobile Gaming, Knowledge Management, Logistics, Defense & Military, Agriculture, Streaming Services"
4570,"Adventure Tourism, Dairy Industry, Cloud Computing, Education Technology, Financial Inclusion, Copywriting, Biometric Authentication, Drones, SEO"
4571,Coffee & Tea Industry
4572,"Corporate Social Responsibility, Wholesale, Education, Human Resources, Online Course Creation, Compliance & Regulations, Crowdsourcing, Pharmaceuticals, Yoga & Wellness, Subscription Services, Wearable Devices, Journalism, Pest Control, Watches, Indie Filmmaking"
4573,"Hydroelectric Power, Cloning & Stem Cell Research, Digital Storytelling, 3D Animation, Cyberwarfare, Aerospace, Yachting"
4574,"Human Resources, FinTech"
4575,"Copywriting, Content Creation, Online Learning, Microfinance, Insurance, Community Building, Transhumanism, Defense & Military, Venture Capital, Crowdsourcing"
4576,"Interior Design, Gaming Consoles, Digital Nomad Lifestyle, Disaster Relief, SETI, Facial Recognition, Auditing, Robotics, Engineering, Digital Storytelling, Psychology, Fashion Industry, Student Loans, Indie Game Development"
4577,"Firearms & Ammunition, Disaster Relief, Perfumes, Self-Publishing, Digital Identity, Aerospace, Restaurants, Offshore Oil & Gas, Big Data Analytics, Movies & Entertainment, Recycling Industry, Financial Inclusion, Logistics, Autonomous Vehicles, Gambling"
4578,"Crowdsourcing, Gardening & Landscaping, Art Market, Textiles, Digital Marketing, Higher Education"
4579,"Interior Design, Investment, Electric Vehicles, Hospitality, 3D Animation, Transhumanism, Autonomous Vehicles, Leadership Training, Community Building, Remote Work Productivity, FMCG, Annuities & Pensions, Entrepreneurship"
4580,"Restaurants, Finance, Data Science"
4581,"Footwear, Cryptocurrency Mining, Affiliate Marketing, Streaming Platforms, E-commerce, Personal Training, Private Jets, Online Course Creation, Biotechnology Startups"
4582,"DIY & Home Improvement, Land Development, Crisis Management, Watches, Private Jets"
4583,"Power Distribution, 3D Printing, Esports, Gaming, Sound Engineering, Streaming Platforms, Smartwatches, Digital Twins, Intellectual Property, Football, Finance, Construction, UFO Studies"
4584,Student Loans
4585,"Beauty & Cosmetics, Power Distribution, Smart TVs, Knowledge Management"
4586,"Diet & Nutrition, Renewable Agriculture, Diversity & Inclusion, Immigration Services, Social Work, Hospitals, Board Games, Urban Planning, Sustainable Fashion"
4587,"Architecture, Music Industry, Higher Education, Esports, Data Science, Fashion Industry, Biometric Authentication, Online Safety, Music Production, 3D Animation, 3D Printing, Mindfulness & Meditation"
4588,"Extraterrestrial Life Research, Audio Equipment, Think Tanks"
4589,"Biohacking, Entrepreneurship, Gardening & Landscaping, Social Media Regulation, Psychology, Home Security, Basketball"
4590,"Retail, Biotechnology Startups, AI Ethics, Cryptocurrency Mining, Food Delivery Services, Disaster Relief, Wealth Management, Accounting Services, Small Business Management, Genetic Engineering, Horse Racing, Renewable Construction Materials, 3D Printing"
4591,"Public Transport, Consumer Electronics, Charity Organizations"
4592,"Alcoholic Beverages, Vegan & Organic Foods, Augmented Reality, Beauty & Cosmetics, Digital Storytelling, Furniture Industry, UFO Studies, Hydroelectric Power, Medical Devices, Copywriting, Space Tourism, Tarot Reading, Betting Strategies, Tutoring"
4593,"FMCG, Ayurveda, Jewelry"
4594,"Fitness Tech, Precious Metals, Archaeology, Microfinance, Research & Development, Aerospace, Freelancing, Movies & Entertainment, Land Development, Higher Education, Perfumes, Indie Game Development, Public Policy"
4595,"Cloning & Stem Cell Research, Renewable Construction Materials, Digital Law, Herbal Remedies"
4596,"Data Science, Solar Energy, Indie Filmmaking, Geothermal Energy, Metaverse, Business Intelligence, Fashion Industry, Mobile Gaming, Gardening & Landscaping, Autonomous Vehicles, Homeopathy, Legal Tech, Corporate Social Responsibility, Nuclear Energy, Yachting"
4597,"Geothermal Energy, Private Jets, PPC Advertising, Beauty & Cosmetics, AI Ethics, DIY & Home Improvement, Humanitarian Aid, Government Affairs, Pest Control, Gig Economy, Coffee & Tea Industry, Pharmaceuticals"
4598,"Wearable Payments, Voice Acting"
4599,"AI Ethics, Precious Metals, Voice Acting, Knowledge Management, Social Media Regulation, Online Course Creation, Logistics, Space Tourism"
4600,"Public Relations, Coworking Spaces, Restaurants, Semiconductor Industry, Charity Organizations, Blockchain, Education, IoT, Space Exploration, NGO"
4601,"Smart Cities, Indie Game Development, Accounting Services, Tutoring, Metaverse, Ayurveda, Cybersecurity, Space Exploration, Biotechnology, Sustainable Fashion"
4602,Biohacking
4603,Food Delivery Services
4604,"Dairy Industry, Smartwatches, Movies & Entertainment, SETI, Leadership Training, Sustainable Fashion, Tax Consulting, Precious Metals, Augmented Reality, Education, DIY & Home Improvement, Firearms & Ammunition, Coworking Spaces, Wholesale"
4605,"Venture Capital, Digital Nomad Lifestyle, High-Stakes Poker, Government Affairs"
4606,"Crisis Management, Development, Digital Identity, PPC Advertising, Architecture, Meat Processing, Cloud Computing, Biotechnology, Freelancing, Paranormal Investigations"
4607,"Renewable Energy, Cybersecurity, Compliance & Regulations, Smart Grids, Estate Planning, Streaming Services, AI Ethics"
4608,"Hunting & Fishing, Leadership Training, Geothermal Energy, Esports, Real Estate, Estate Planning, Spirituality, Fisheries, Extraterrestrial Life Research, Mining Industry, Indie Game Development, Metaverse, Anthropology, Firearms & Ammunition, Footwear"
4609,"Wholesale, Higher Education, Cybersecurity, Steel, Hardware Manufacturing, Watches"
4610,"Gaming Consoles, UFO Studies, Crowdfunding, Cyberwarfare, Textiles, Retirement Planning, Children’s Digital Rights, Facial Recognition, PPC Advertising, Footwear, Psychology, E-commerce, Intellectual Property, Life Coaching, Ethical Hacking"
4611,"Neobanks, International Law, Digital Marketing, Ethical Hacking, Blockchain"
4612,"Entrepreneurship, E-commerce, Mars Colonization, Education Technology, Movies & Entertainment, Personal Branding, DIY & Home Improvement, Fraud Detection, Online Safety"
4613,"Metaverse, Betting Strategies, 3D Printing, Online Learning, Intellectual Property, Ayurveda, Fantasy Sports, Home Automation"
4614,"Biohacking, Nightlife"
4615,"Restaurants, Consumer Electronics, Search Engine Optimization, Indie Game Development"
4616,"Community Building, DIY & Home Improvement"
4617,"Geothermal Energy, Search Engine Optimization, Precious Metals"
4618,"Crowdsourcing, SETI, Sustainable Fashion, Skincare, Art Market, Circular Economy, Coffee & Tea Industry, Personal Training, Public Transport, Luxury Goods, Indie Filmmaking, Climate Change, Hardware Manufacturing, Nightlife, Firearms & Ammunition"
4619,"AI & Machine Learning, Influencer Marketing, Fundraising, Facial Recognition, Space Exploration, Renewable Energy"
4620,"Private Equity, Cyberwarfare, Higher Education, Annuities & Pensions, Finance, Education, IT Infrastructure, Online Betting, Waste Management, Land Development, Biotechnology, Tarot Reading, High-Fashion Brands"
4621,"Neobanks, Beauty & Cosmetics, Affiliate Marketing, Alcoholic Beverages"
4622,"Wearable Payments, Home Automation, Homeopathy, Semiconductor Industry, Cloning & Stem Cell Research, Recruitment, Food Processing, Astrology, SETI, Digital Nomad Lifestyle"
4623,Spirituality
4624,"Employee Benefits, High-Fashion Brands, Search Engine Optimization, Spirituality, Movies & Entertainment, Remote Work Productivity, International Law"
4625,"Robotics, Business Intelligence, Board Games, Test Preparation, SEO, Horse Racing, High-Stakes Poker, 3D Animation, Gig Economy, Mobile Gaming, Esports"
4626,"Board Games, Hospitality, Home Security, Mars Colonization, Tarot Reading, Beauty & Cosmetics, Algorithmic Bias, Semiconductor Industry, Banking, Public Policy"
4627,"Entrepreneurship, Public Policy, Fraud Detection, Firearms & Ammunition, Retail, Finance, Yoga & Wellness, Music Production, Medical Devices"
4628,"Voice Acting, Digital Twins, Subscription Services, Indie Filmmaking, Bioethics, Charity Organizations, Traditional Chinese Medicine, Astrology, Land Development, Search Engine Optimization"
4629,"Fashion Industry, Small Business Management, Corporate Governance"
4630,"Content Creation, Cloud Computing, Lobbying, Wearable Payments, Social Work, Vegan & Organic Foods, Home Automation, Crowdfunding, Education"
4631,"Digital Twins, Workplace Safety, Biohacking, Recruitment, Crowdsourcing, K-12 Education, Franchising, Crisis Management, Student Loans, Event Management, Social Media Regulation, Lottery, Private Equity, Marine Technology"
4632,"Cryptocurrency Mining, Hardware Manufacturing"
4633,"Financial Inclusion, Mining Industry"
4634,"Venture Capital, Homeopathy, Pest Control, Workplace Safety, Cloud Computing, Biotechnology Startups, Fisheries, Corporate Governance"
4635,"Ethical Hacking, Payroll Management, Retail"
4636,"Waste Management, Consumer Electronics, Personal Training, Yoga & Wellness, Reputation Management, Employee Benefits, High-Stakes Poker, Sustainable Fashion, Medical Devices, Mindfulness & Meditation, Genetic Engineering, Marine Technology, Bioethics, ESG, Private Equity"
4637,"Meat Processing, Anti-Money Laundering, Casinos, Crowdsourcing, SaaS, Public Housing, SETI, Urban Planning, Humanitarian Aid"
4638,"Sound Engineering, Startups, Auditing, Legal Tech"
4639,"Influencer Marketing, Pest Control, Surveillance, Fundraising"
4640,"Lottery, Coworking Spaces, Real Estate, Supply Chain, Surveillance, Corporate Social Responsibility, Cryptocurrency Mining, Textiles, Sustainable Fashion"
4641,"Perfumes, Climate Change, Textiles, SEO, Wind Energy"
4642,"Geothermal Energy, Community Building, Freelancing, Gambling, NFTs, Food Processing, Recycling Industry, Textiles, Restaurants, Offshore Oil & Gas, K-12 Education, Compliance & Regulations, Esports, Retirement Planning"
4643,"Consultancy, Employee Benefits, Offshore Oil & Gas, Marine Technology"
4644,"Restaurants, Development"
4645,"IoT, Diet & Nutrition, Waste Management, Coworking Spaces, Adventure Sports, Sustainability, Defense & Military, Podcasting, Furniture Industry, Fantasy Sports, Casino Gaming, Affiliate Marketing, Smart Grids, Biometric Authentication, Dairy Industry"
4646,"Interior Design, Smart Cities, Facial Recognition, Adventure Tourism, Indie Game Development"
4647,"Food Processing, Co-Working Spaces, Interior Design, Loan Management, Paranormal Investigations, Streaming Services, Biotechnology Startups, Drones, IoT, Content Creation, Spirituality, Hardware Manufacturing, Auditing, Renewable Agriculture"
4648,"Think Tanks, Space Exploration, Metaverse, Alcoholic Beverages, FMCG, Autonomous Vehicles, Consultancy, Adventure Sports, Education, Horse Racing"
4649,"Mobile Gaming, Nuclear Energy, Land Development, Biotechnology Startups, Fitness Tech, Solar Energy, Smartwatches, Bioethics, AI Ethics, Recruitment, Archaeology, Entrepreneurship"
4650,"Autonomous Vehicles, Social Work, Facial Recognition, Indie Filmmaking, Spirituality, Ayurveda"
4651,"Recycling Industry, Board Leadership, Compliance & Regulations, High-Stakes Poker, Online Learning, Logistics, Astrology, PPC Advertising, Biometric Authentication"
4652,"SETI, Sound Engineering, Extraterrestrial Life Research, Open Source Software, Renewable Energy, Gardening & Landscaping, Logistics, Jewelry, Crowdsourcing, Esports"
4653,"ESG, Gambling, Football, Art Market, Firearms & Ammunition, Waste Management"
4654,"Hospitality, Banking, PPC Advertising, Smart TVs, Architecture, Lobbying, Crowdfunding, Steel, Streaming Platforms, Cryptozoology, Gaming, Fraud Detection"
4655,"Podcasting, Space Tourism, Nuclear Energy, Public Policy, Corporate Governance, Fantasy Sports, Blockchain, Adventure Sports, Venture Capital, Private Jets"
