company_masked,old_value
3024,"Pharmaceuticals, Climate Change, Cultural Heritage, Home Automation, Online Betting, Football, Motorsport, Fashion Industry, Mindfulness & Meditation, Leadership Training, Neobanks, Tarot Reading, Tax Consulting, Venture Capital"
3025,"Finance, Homeopathy, Smart Grids, Nightlife, Event Management, Annuities & Pensions, Footwear, UFO Studies, Crowdsourcing"
3026,"Retirement Planning, SEO"
3027,"Recruitment, Automotive, Casino Gaming, Fisheries, Indie Filmmaking, Humanitarian Aid, Yachting, Mindfulness & Meditation, Skincare"
3028,"Open Source Software, Insurance, Crowdsourcing, Paranormal Investigations, Autonomous Vehicles, Yachting, Architecture, Development, Wealth Management, Lobbying, Satellite Technology, Bioethics, Power Distribution, Social Media Regulation"
3029,"Smart Grids, Waste Management, Crowdfunding, Education Technology, Big Data Analytics, Engineering, Cryptocurrencies, Mindfulness & Meditation, Renewable Energy, Book Publishing"
3030,"Home Security, Education Technology, Ride-Sharing, Mindfulness & Meditation, Auditing, Life Coaching, Drones, Charity Organizations, Cryptocurrency Mining, Cloud Computing, Autonomous Vehicles"
3031,"Auditing, AI & Machine Learning, Smart Cities, Wind Energy"
3032,"Compliance & Regulations, Mobile Gaming, Augmented Reality, Test Preparation, Influencer Marketing, FMCG, Extraterrestrial Life Research, Hunting & Fishing, Privacy & Data Protection, Social Media Regulation, Nuclear Energy"
3033,"Recycling Industry, Yachting"
3034,"Hunting & Fishing, Annuities & Pensions, Robotics, Leadership Training, Corporate Social Responsibility, Satellite Technology, Genetic Engineering, Footwear, Smart Homes"
3035,SEO
3036,"Adventure Sports, Bioethics, Paranormal Investigations, Humanitarian Aid"
3037,"Social Media Regulation, Education, Crowdfunding, Copywriting, SETI, Medical Devices, K-12 Education, Hunting & Fishing, Digital Identity, Human Resources, Vegan & Organic Foods"
3038,"Alternative Medicine, IT Infrastructure, Defense & Military, Social Work, Ride-Sharing, High-Fashion Brands, Cultural Heritage, Blockchain, Digital Twins, Power Distribution"
3039,"Renewable Construction Materials, Spirituality, Sustainability, Influencer Marketing, Urban Planning, Tutoring, Social Media, Extraterrestrial Life Research, Payroll Management"
3040,"Renewable Agriculture, Offshore Oil & Gas"
3041,"Wearable Devices, Small Business Management, Personal Training, Spirituality, Hospitality"
3042,"Immigration Services, Furniture Industry, Corporate Social Responsibility, Engineering, Philosophy, Wearable Payments, Data Science, DIY & Home Improvement, Electric Vehicles, ESG, Co-Working Spaces, Offshore Oil & Gas, Gardening & Landscaping, Mindfulness & Meditation, Insurance"
3043,"Consumer Electronics, Satellite Technology, Cryptocurrencies, Government Affairs, Book Publishing, Credit Cards, Cryptozoology, Furniture Industry, Virtual Reality, Cloning & Stem Cell Research"
3044,"Cryptozoology, Marine Technology, Herbal Remedies, Drones, Board Games, Perfumes, Digital Twins"
3045,"Think Tanks, Yachting, Online Safety, Gaming, Renewable Energy, Development, Adventure Sports, Supply Chain, Cybersecurity, Hospitality, Food Delivery Services, Geothermal Energy, High-Fashion Brands, Waste Management"
3046,"Fitness Tech, Streaming Services, Open Source Software, Circular Economy, Insurance"
3047,"Anthropology, Public Policy, AI & Machine Learning, SETI, Leadership Training, Astrology, 3D Printing, Virtual Reality, Knowledge Management, Streaming Services, Payroll Management, Cryptocurrency Mining"
3048,"International Law, Hospitality, Venture Capital, Movies & Entertainment, Mindfulness & Meditation, Fashion Industry, Engineering, Alternative Medicine, Streaming Services"
3049,"Pharmaceuticals, 3D Animation, Music Production, Metaverse, Social Work, Semiconductor Industry, Anthropology, Cryptocurrencies, Alternative Medicine, Homeopathy"
3050,"Higher Education, Ride-Sharing, Social Media, Space Tourism, Social Work"
3051,"Digital Banking, Renewable Energy, Perfumes, Supply Chain, Tax Consulting"
3052,"Tarot Reading, Corporate Social Responsibility, IT Infrastructure, Casino Gaming, Privacy & Data Protection, Hospitals, Social Media, Corporate Governance"
3053,"Freelancing, Automotive, Coffee & Tea Industry, Horse Racing, Electric Vehicles, SETI, Virtual Reality, Copywriting"
3054,"Space Exploration, Interior Design, Special Education"
3055,"Smart Cities, Business Intelligence, Loan Management, Development, Co-Working Spaces, Biotechnology"
3056,"AI & Machine Learning, Esports, Remote Work Solutions, Student Loans, Steel, Remote Work Productivity, Architecture, High-Stakes Poker, Co-Working Spaces"
3057,Online Betting
3058,"Anthropology, Beauty & Cosmetics, Semiconductor Industry"
3059,"Loan Management, Spirituality, Gambling, Engineering"
3060,"Ethical Hacking, Annuities & Pensions, Blockchain"
3061,"Marine Technology, Textiles, Climate Change, Tarot Reading, Education, Social Media, Genetic Engineering, Startups, Education Technology"
3062,"Cloud Computing, Influencer Marketing, Leadership Training, Wind Energy, Agriculture"
3063,"Reputation Management, Tennis, Content Creation, Archaeology, Dairy Industry, Gig Economy, Higher Education, Electric Vehicles, Online Safety, Hi-Fi & Vinyl"
3064,"Semiconductor Industry, Medical Devices, Cybersecurity, Virtual Reality, Offshore Oil & Gas, Loan Management, Facial Recognition, Biohacking, Online Betting, Startups, Self-Publishing"
3065,"Indie Filmmaking, Marine Technology, Satellite Technology, Podcasting, Real Estate, Remote Work Solutions, Event Management, Ayurveda"
3066,"Workplace Safety, Adventure Tourism, Biotechnology Startups, Charity Organizations"
3067,"Sustainable Fashion, Home Cleaning Services"
3068,"Semiconductor Industry, Insurance, Ride-Sharing, Intellectual Property, Knowledge Management, K-12 Education, Human Resources, Annuities & Pensions, Healthcare, Basketball, Public Transport, Land Development, Bioethics"
3069,Public Policy
3070,"3D Animation, Esports, Open Source Software, Test Preparation, Smart Cities"
3071,"Board Leadership, Digital Marketing, High-Stakes Poker, Reputation Management, Fantasy Sports, Public Transport, Restaurants, Gardening & Landscaping, Legal Tech, 3D Printing, SaaS, Public Relations, Accounting Services, Community Building, Online Course Creation"
3072,"Diversity & Inclusion, Watches, Aerospace, Human Resources, Mining Industry, Food Delivery Services"
3073,"Workplace Safety, Business Intelligence, Consultancy, 3D Animation, Genetic Engineering, Digital Storytelling, Social Media Regulation, Hi-Fi & Vinyl"
3074,"Solar Energy, Fitness Tech, Pest Control, Augmented Reality, Cloud Computing"
3075,"Hospitals, Co-Working Spaces, Betting Strategies, Subscription Services, Journalism, Luxury Goods, Paranormal Investigations, Gambling"
3076,"Steel, Meat Processing, Payroll Management, Automotive, Digital Twins"
3077,"Crowdfunding, Hardware Manufacturing, Special Education, Venture Capital, Solar Energy, Remote Work Productivity, Blockchain, Neobanks, Food Processing, Community Building, Workplace Safety, Nightlife, SEO"
3078,"Social Media, Disaster Relief, Ayurveda, Recycling Industry, High-Stakes Poker, Startups, Legal Tech, Tennis, Corporate Governance, Biotechnology, IoT, Hospitals, Basketball"
3079,"Yachting, Gambling, Solar Energy, High-Stakes Poker, Biotechnology Startups"
3080,"Streaming Platforms, Public Policy, Real Estate Investment Trusts, SEO, Crowdfunding"
3081,"Workplace Safety, Wealth Management, Food Delivery Services, Mental Health Awareness, Smart Cities, Crisis Management, Ethical Hacking, Think Tanks"
3082,"FinTech, Legal Tech, Dairy Industry"
3083,"Drones, High-Stakes Poker, Anthropology, Wearable Devices, Waste Management, Cultural Heritage, Digital Forensics, Entrepreneurship, Alcoholic Beverages, Music Production, Startups, Traditional Chinese Medicine, Fundraising, Home Security"
3084,"Podcasting, Dairy Industry, Herbal Remedies, Board Games, Biohacking"
3085,Astrology
3086,"Wealth Management, Construction, Wearable Devices, Education, Pest Control"
3087,"Nuclear Energy, Watches, Voice Acting, K-12 Education, Agriculture, Smart Cities, Lottery, Metaverse, Cybersecurity, Online Safety"
3088,"Streaming Platforms, NFTs, Extraterrestrial Life Research, Copywriting, Workplace Safety"
3089,"Knowledge Management, UFO Studies, Agriculture, Disaster Relief"
3090,"Small Business Management, Research & Development, Personal Branding, Entrepreneurship, Astrology, SEO, Stock Markets"
3091,"Children’s Digital Rights, Aerospace, Facial Recognition, Intellectual Property, Robotics, Construction, Coworking Spaces, Fitness Tech, Urban Planning, Cloning & Stem Cell Research, Solar Energy, Autonomous Vehicles, Education"
3092,Psychology
3093,Smart Homes
3094,"Bioethics, Smart Homes, Indie Filmmaking, Hardware Manufacturing"
3095,"Children’s Digital Rights, Digital Identity, Human Resources, Subscription Services, Pest Control, PPC Advertising, Virtual Reality, Smartwatches, Board Games, Privacy & Data Protection, Jewelry, Space Tourism, Gaming, Power Distribution"
3096,"Disaster Relief, Anti-Money Laundering, SEO, Mindfulness & Meditation, NFTs & Digital Art, Search Engine Optimization"
3097,Co-Working Spaces
3098,"Event Management, Intellectual Property, Gaming, Fraud Detection, Construction, Business Intelligence, Charity Organizations, Recycling Industry, Digital Twins, Subscription Services, Tutoring, Cultural Heritage"
3099,"Digital Storytelling, SETI, Entrepreneurship, Beauty & Cosmetics, Fashion Industry, Estate Planning"
3100,"Mindfulness & Meditation, Legal Tech, Healthcare, Wearable Payments, High-Fashion Brands, Development"
3101,"Gig Economy, Football, Remote Work Solutions, Biometric Authentication, Facial Recognition, Homeopathy, FinTech, FMCG, Movies & Entertainment, Franchising, Education Technology, Tax Consulting, Food Delivery Services"
3102,"Biotechnology Startups, NGO, Data Science, Restaurants"
3103,"Board Games, Loan Management, Higher Education, Precious Metals"
3104,"Automotive, Sustainable Fashion, Philanthropy, Immigration Services, Social Media Regulation, Vegan & Organic Foods, Search Engine Optimization, Gig Economy, Food Delivery Services, Offshore Oil & Gas, Self-Publishing, Auditing, Big Data Analytics, Beauty & Cosmetics, Entrepreneurship"
3105,"Small Business Management, Wholesale, Home Cleaning Services, Cryptozoology, Real Estate, NFTs, Gaming, Steel, Personal Branding"
3106,"Book Publishing, Longevity Science, Anthropology, Semiconductor Industry, Virtual Reality, Drones, Smart Grids, Mobile Gaming, Beauty & Cosmetics, Movies & Entertainment, Hi-Fi & Vinyl"
3107,"Public Policy, Copywriting, Private Equity, Insurance, Stock Markets, Online Course Creation, Construction, Circular Economy, Furniture Industry, Casinos, Banking"
3108,Startups
3109,"Event Management, Urban Planning, Casino Gaming, Cloud Computing, Anti-Money Laundering, Intellectual Property, Social Work, Supply Chain, Smart Grids, Psychology, Mobile Gaming, Streaming Platforms"
3110,"Lobbying, Membership Sites, Cyberwarfare, Retirement Planning, Disaster Relief, Loan Management, Recruitment, Basketball, Social Work, Steel, Accounting Services, Home Automation, Private Jets"
3111,"Employee Benefits, Subscription Services, Sports, Nuclear Energy, Drones, Online Learning, Hunting & Fishing, Horse Racing, Cloning & Stem Cell Research, Homeopathy"
3112,"Dropshipping, Casino Gaming, Food Delivery Services, Robotics, Event Management, Adventure Sports, Journalism, Consumer Electronics"
3113,"Children’s Digital Rights, Gambling, Mars Colonization, Carbon Offsetting, Board Games, Meat Processing, Circular Economy, Semiconductor Industry, Private Jets, Intellectual Property, Defense & Military, Algorithmic Bias, K-12 Education"
3114,"Corporate Social Responsibility, Privacy & Data Protection, Genetic Engineering"
3115,"Biotechnology Startups, Home Security, Robotics, Cultural Heritage, Wearable Devices"
3116,"Dairy Industry, Wearable Devices, Tennis, Algorithmic Bias, Compliance & Regulations, Digital Identity, UFO Studies, Membership Sites"
3117,Wearable Devices
3118,"Longevity Science, International Law, Nightlife, Workplace Safety, Sports, UFO Studies, Alternative Medicine, Accounting Services, SEO, Gaming Consoles, Online Course Creation"
3119,"Big Data Analytics, Betting Strategies, Remote Work Productivity, AI Ethics, Fisheries, Social Media Regulation, Small Business Management, Augmented Reality"
3120,"Satellite Technology, Homeopathy, Smartwatches, Open Source Software, Human Resources"
3121,"Hunting & Fishing, Homeopathy, Extraterrestrial Life Research, Meat Processing, Music Production, Renewable Construction Materials, Facial Recognition, Basketball, Hardware Manufacturing, Public Policy, Ethical Hacking, Food Processing"
3122,"Drones, Footwear, Betting Strategies, Digital Storytelling, Smart TVs, Corporate Social Responsibility, Basketball, Cyberwarfare, Precious Metals, Content Creation"
3123,"Fraud Detection, Self-Publishing, Space Exploration, Gaming, Medical Devices, Smart Cities, Extraterrestrial Life Research, Autonomous Vehicles"
3124,"Nightlife, Pharmaceuticals, Real Estate Investment Trusts, Cloud Computing, Alcoholic Beverages, Recycling Industry, Archaeology, PPC Advertising, Consultancy, Development"
3125,"Development, Digital Storytelling, Open Source Software, K-12 Education, Private Jets, Robotics, Co-Working Spaces, Research & Development, Land Development, Augmented Reality, Digital Twins"
3126,"Biotechnology Startups, Precious Metals, Recruitment, Wealth Management, Cyberwarfare"
3127,"Digital Law, FMCG, Traditional Chinese Medicine, Real Estate, Horse Racing, 3D Animation, Hospitality, Coffee & Tea Industry"
3128,"Smart Cities, Sustainable Fashion, Tennis, Insurance, PPC Advertising, FMCG, Nuclear Energy"
3129,"3D Printing, Restaurants, Crowdfunding, Membership Sites, Content Creation, Digital Marketing, Defense & Military, Smart Cities, Special Education, Online Learning, Hunting & Fishing, Franchising, Yachting"
3130,"Tennis, Crowdsourcing, Movies & Entertainment, Surveillance, Fundraising, Subscription Services, Journalism, Supply Chain, Accounting Services"
3131,"Disaster Relief, Land Development, Mental Health Awareness, Pest Control, Betting Strategies, Food Delivery Services, Affiliate Marketing, Esports, Startups, Nightlife, PPC Advertising"
3132,"Audio Equipment, Leadership Training, Agriculture, 3D Printing, Renewable Energy, Food Processing, Diversity & Inclusion, Neobanks, Cloud Computing"
3133,"Business Intelligence, Smart TVs, Gaming Consoles, Franchising, Accounting Services, Streaming Platforms, Steel, Longevity Science, Ethical Hacking, Skincare, Drones"
3134,Pharmaceuticals
3135,"Biotechnology Startups, Humanitarian Aid, Charity Organizations, Lottery, Sports, Investment, Social Work, Herbal Remedies"
3136,"Wind Energy, ESG, Food Delivery Services"
3137,"Watches, Membership Sites, Affiliate Marketing, Smart Cities, Content Creation, Wealth Management, NFTs & Digital Art"
3138,"Food Delivery Services, Land Development, Sound Engineering, Beauty & Cosmetics, Herbal Remedies, Genetic Engineering"
3139,"Consultancy, Social Media, Fisheries, Open Source Software, Beauty & Cosmetics"
3140,"Real Estate, Paranormal Investigations, Sound Engineering, Crowdsourcing, Cryptocurrency Mining, Urban Planning, Watches, Anti-Money Laundering, Jewelry, Firearms & Ammunition, Sports, Coworking Spaces, Marine Technology"
3141,"Employee Benefits, Homeopathy, Children’s Digital Rights, Subscription Services, Startups"
3142,"Stock Markets, PPC Advertising, Transhumanism, Think Tanks, Biohacking, Education Technology"
3143,"Microfinance, Real Estate Investment Trusts, K-12 Education"
3144,"Defense & Military, Education Technology, Gaming, Voice Acting, Mars Colonization, SEO, Paranormal Investigations, FinTech, Big Data Analytics, Basketball, Agriculture, Sound Engineering, Cloud Computing, Workplace Safety, Renewable Energy"
3145,"Sustainability, Wearable Payments, Investment, Research & Development, Smart Cities, Renewable Energy, Children’s Digital Rights, High-Stakes Poker, Smartwatches, Adventure Sports"
3146,"Mental Health Awareness, DIY & Home Improvement, Defense & Military, 3D Printing, Philanthropy, Recycling Industry, Dairy Industry"
3147,"Geothermal Energy, Online Safety, Cyberwarfare, Sustainable Fashion, Annuities & Pensions, Community Building, Audio Equipment, Home Automation, AI & Machine Learning, Credit Cards, Philanthropy, Indie Filmmaking, Home Security"
3148,"Children’s Digital Rights, Traditional Chinese Medicine, Ethical Hacking, Pharmaceuticals, Fitness Tech, Satellite Technology"
3149,"Space Exploration, Agriculture, Online Course Creation, Luxury Goods, E-commerce, Retirement Planning, Copywriting, Retail, Virtual Reality, Student Loans, Carbon Offsetting, DIY & Home Improvement"
3150,"Digital Identity, Social Media, Workplace Safety, Smart Homes, Education, Algorithmic Bias"
3151,"Human Resources, Virtual Reality, Children’s Digital Rights, Spirituality, Loan Management"
3152,"Food Delivery Services, Furniture Industry, Steel, Charity Organizations, Test Preparation, Personal Branding, Diversity & Inclusion, Cryptozoology, Biotechnology, Architecture, High-Fashion Brands, Firearms & Ammunition, Copywriting, Board Games"
3153,"Vegan & Organic Foods, Compliance & Regulations, Mental Health Awareness, Startups, Digital Marketing, AI & Machine Learning, Banking, Retail, Smart Cities, Recruitment, Nightlife, Disaster Relief, Sustainable Fashion"
3154,"Disaster Relief, Paranormal Investigations, Watches, Augmented Reality, Education, Mobile Gaming, Renewable Agriculture, Biotechnology Startups, Open Source Software"
3155,"Digital Storytelling, Smart TVs, Vegan & Organic Foods, Cybersecurity, Interior Design, FMCG, Skincare, Food Delivery Services"
3156,"Finance, Investment, Tennis, Aerospace"
3157,"Big Data Analytics, Tax Consulting, Augmented Reality, Pharmaceuticals, NFTs, Employee Benefits, Archaeology, Self-Publishing, Music Production, Agriculture"
3158,"Fantasy Sports, Data Science, Automotive"
3159,"Fraud Detection, Music Industry, High-Stakes Poker, Power Distribution, Social Media, Employee Benefits, Facial Recognition, Podcasting, Consumer Electronics, Remote Work Solutions, Geothermal Energy, Fundraising"
3160,"Search Engine Optimization, Content Creation, Private Equity, SaaS, Government Affairs, Corporate Social Responsibility, Watches, Student Loans, Hardware Manufacturing, Home Automation, Venture Capital, Sustainable Housing, Offshore Oil & Gas, Fraud Detection, Charity Organizations"
3161,"Public Relations, Space Exploration, Biotechnology, Payroll Management, Remote Work Solutions, Alcoholic Beverages, Compliance & Regulations, Gardening & Landscaping, Smart Grids, Bioethics, Robotics"
3162,"Restaurants, Space Tourism"
3163,"Motorsport, Freelancing, Adventure Tourism, Archaeology, Personal Training, Cryptocurrency Mining, Paranormal Investigations, Compliance & Regulations, Gaming, Test Preparation"
3164,"Data Science, Credit Cards, Stock Markets, Big Data Analytics, Blockchain, Board Leadership, Algorithmic Bias, Engineering, Logistics, Indie Filmmaking, Paranormal Investigations, Electric Vehicles, Casinos, Fraud Detection, Food Processing"
3165,"Real Estate, Co-Working Spaces, Freelancing, Social Media, Think Tanks, Space Exploration, Sustainable Fashion, Satellite Technology, Public Relations"
3166,"Paranormal Investigations, Finance, Semiconductor Industry, Insurance, Digital Nomad Lifestyle"
3167,"Construction, Private Equity, Traditional Chinese Medicine, NFTs, Big Data Analytics, Payroll Management, Podcasting, Casinos, Footwear"
3168,"Tarot Reading, Carbon Offsetting, Circular Economy, Herbal Remedies, Sports, Power Distribution, Knowledge Management, Self-Publishing, Drones, Cultural Heritage"
3169,"Cyberwarfare, Hospitals, Fundraising, Event Management, Mars Colonization, Manufacturing, Alternative Medicine"
3170,"Humanitarian Aid, ESG, Fundraising, Public Transport, Sustainable Fashion, Adventure Tourism, Tax Consulting"
3171,"Hospitality, Recruitment, Renewable Agriculture, Digital Identity, Home Automation, Movies & Entertainment"
3172,"Land Development, Indie Game Development"
3173,"Accounting Services, Privacy & Data Protection, Alternative Medicine, Hospitality, Archaeology, Cyberwarfare, Psychology, ESG, Recruitment, Facial Recognition, Immigration Services"
3174,"3D Printing, Smart Cities, Surveillance, NFTs & Digital Art, Annuities & Pensions, Wholesale, Restaurants, Test Preparation, Social Work, Lottery, Digital Law, Fantasy Sports, PPC Advertising, Autonomous Vehicles"
3175,"Co-Working Spaces, Financial Inclusion, High-Fashion Brands, Biotechnology Startups, Textiles, Perfumes, Beauty & Cosmetics, Freelancing, Tutoring, Cyberwarfare"
3176,"International Law, Football, Crowdfunding, Journalism, Public Relations, 3D Printing, Land Development, Coffee & Tea Industry, Aerospace, Indie Filmmaking, Real Estate Investment Trusts, Furniture Industry, Precious Metals"
3177,"Event Management, Steel, DIY & Home Improvement, Cloning & Stem Cell Research, Venture Capital, Employee Benefits, Dropshipping, Annuities & Pensions, Adventure Sports, Engineering, Yachting, NGO"
3178,"Microfinance, Adventure Tourism, Dropshipping, Lottery, Public Housing, Gambling, Offshore Oil & Gas, Digital Nomad Lifestyle, Architecture, Hunting & Fishing, Voice Acting, Astrology, Indie Game Development, SaaS"
3179,"Online Course Creation, UFO Studies, Legal Tech, Home Automation, Smart TVs, Steel, Facial Recognition, Fraud Detection, Coffee & Tea Industry, Agriculture, Corporate Governance, Alternative Medicine, 3D Printing, Herbal Remedies, Consultancy"
3180,Digital Identity
3181,"IT Infrastructure, Financial Inclusion, Crowdfunding, Lobbying, Facial Recognition"
3182,"Wealth Management, Public Transport, Digital Law, Facial Recognition, Algorithmic Bias, 3D Printing, Steel, Precious Metals, Think Tanks, Digital Marketing, Corporate Social Responsibility, Circular Economy, Mindfulness & Meditation"
3183,"Footwear, Space Exploration, Knowledge Management, Renewable Agriculture, Gaming Consoles, Music Production, Textiles, Esports"
3184,"Copywriting, Business Intelligence, Home Cleaning Services, Tennis, Wind Energy, Drones"
3185,"Hi-Fi & Vinyl, Space Tourism, Retail, Home Cleaning Services, Board Games, Satellite Technology, Public Relations"
3186,"Social Media, Virtual Reality, Digital Banking, Fashion Industry"
3187,NFTs & Digital Art
3188,"Compliance & Regulations, Anti-Money Laundering, Business Intelligence, Facial Recognition, K-12 Education, Mining Industry, Mobile Gaming, Insurance, Marine Technology, Real Estate Investment Trusts, UFO Studies, Tax Consulting"
3189,"Blockchain, Facial Recognition, Fisheries, Public Relations, Extraterrestrial Life Research, Social Media Regulation, Crowdfunding, Estate Planning, Mars Colonization, Crisis Management, Special Education, Satellite Technology, Social Media"
3190,"Fraud Detection, Affiliate Marketing, Estate Planning, Adventure Sports"
3191,"Watches, Streaming Platforms, Public Policy, Membership Sites, Fisheries, Online Betting, Waste Management, Gig Economy"
3192,"Business Intelligence, Alternative Medicine, Pharmaceuticals"
3193,"Online Learning, Personal Branding, Smart TVs, Ayurveda"
3194,"Book Publishing, Homeopathy, Movies & Entertainment, Healthcare, Tarot Reading, Charity Organizations, Digital Nomad Lifestyle, Beauty & Cosmetics, Ayurveda"
3195,"Renewable Energy, SEO, Jewelry, Satellite Technology, Mobile Gaming, Space Tourism, Crowdfunding, Supply Chain, Movies & Entertainment, Voice Acting, Bioethics, Payroll Management, Solar Energy, Traditional Chinese Medicine"
3196,"SETI, Robotics, Public Transport, Digital Nomad Lifestyle, Firearms & Ammunition, Biometric Authentication, Yoga & Wellness, Digital Law, Audio Equipment, Philosophy"
3197,"IT Infrastructure, Sustainability, Basketball, FinTech, Human Resources, Remote Work Solutions, Humanitarian Aid, PPC Advertising, Vegan & Organic Foods, Annuities & Pensions, Employee Benefits, Semiconductor Industry, Hi-Fi & Vinyl, Gaming Consoles, Corporate Governance"
3198,Food Processing
3199,"Gaming Consoles, Public Policy, Data Science, Climate Change, Online Learning, Smart Grids, Recruitment, SEO, Real Estate, Fitness Tech, Crowdsourcing, SaaS, Architecture, Real Estate Investment Trusts"
3200,Personal Training
3201,"Fraud Detection, Nightlife, Horse Racing, Special Education"
3202,Carbon Offsetting
3203,"Event Management, Agriculture, Personal Branding, Finance, Auditing, Geothermal Energy, Fraud Detection, Neobanks, Development, Social Media, Cloud Computing"
3204,Digital Marketing
3205,"Biotechnology, Small Business Management, Sports, NGO, Tax Consulting"
3206,"Human Resources, Supply Chain, Cybersecurity, Esports, International Law, Pharmaceuticals, Satellite Technology, Neobanks, Genetic Engineering"
3207,"Smart Grids, Digital Storytelling, Agriculture, Solar Energy, Betting Strategies"
3208,"Yachting, Online Learning, Music Industry, Microfinance, Electric Vehicles, Ethical Hacking, Reputation Management, Alternative Medicine, Digital Forensics, Estate Planning, Cryptozoology, Public Policy, E-commerce, Marine Technology"
3209,"Cultural Heritage, Special Education, Anti-Money Laundering, Social Media Regulation, Loan Management, Fraud Detection, Fantasy Sports, Autonomous Vehicles, Mobile Gaming"
3210,"Fashion Industry, Journalism, Co-Working Spaces, FinTech, Coworking Spaces, Philosophy"
3211,"Lobbying, Mining Industry, Social Media Regulation, Biometric Authentication, Dairy Industry, Personal Training, Ethical Hacking, Genetic Engineering"
3212,"Private Jets, Online Course Creation, Metaverse"
